text,intent
PM govt details,subsidy
bimari attack on wheat,disease
need help with onion water,advice
pest attack on pyaz,disease
NEEDHELP WITH POTATO GROW,advice
kya tomorow temp hogi,weather
need karz for farming,subsidy
IS THERE ANY SARKAR FOR CHAWAL FARMERS,subsidy
onion ke liye kaun sa beej acha hai?,advice
DISEASE PYAZ HELP,disease
is temp coming?,weather
whaturea for aloo,advice
bestugana for wheet,advice
howto save soybean from sukha,disease
is baarish coming?,weather
baarish forecast for punjab,weather
what beej for sarso,advice
govtschem for gehu,subsidy
should i give grow to gehu aaj?,advice
NEED HELP WITH CHAWAL PANI,advice
where to sell sarso for good ret,market
right time for wheet pani,advice
spots tamatar help,disease
is there any pm kisan for dhan farmers,subsidy
tell me gehu mkt,market
MEDICINEFOR DHAN PEST,disease
IS MANDI UP FOR CHAWAL TODDAY?,market
INTERCROPPING WITH KANAK,advice
gehun ka mandi kya hai 2day?,market
whento khad onion?,advice
kya tomorrow wether hogi?,weather
any chance of dhoop kal?,weather
gehu is dying what to do,disease
ismarket up for sarso todday?,market
govt scheme for chawal,subsidy
any chance of baarish next day?,weather
whento ugana rice?,advice
tell me wheat pryce,market
tell me rice mkt,market
my soybean fasal are turning yellow,disease
sarkar status,subsidy
how to apply for karz,subsidy
medicine for potato sukha,disease
barish 2moro,weather
any chance of baarish tomorrow?,weather
IS PAISE UP FOR MUSTARD NOW?,market
is mausam coming,weather
whatwater for tomato?,advice
what grow for gehu?,advice
sarso me yellowing lag gaya,disease
govt govt for corn,subsidy
should i give ugana to sugarcane td,advice
is wether coming?,weather
best dap for soybean,advice
HOWIS THE WEDDER TD?,weather
best fertilizer for tomato,advice
iswether coming?,weather
wether alert needed,weather
need help with rise plant,advice
PM pm kisan details,subsidy
current chawal ret ret,market
corn ka ret kya hai today?,market
isbhav up for soybean todday?,market
howis the mausam aaj,weather
wethertomorrow,weather
too much temp for sarso,weather
soyabean ka mandi kya hai now,market
NEED HELP WITH KAPAS UGANA,advice
govt pm kisan for wheet,subsidy
too much mosam for kanak,weather
onionka paise kya hai today?,market
govt schem for dhan,subsidy
medicine for sugarcane sukha,disease
bugs in gehu,disease
wether forecast for punjab,weather
scheme for tractor,subsidy
sabsidistatus,subsidy
will it heat tmrw?,weather
is barish coming?,weather
kisan credit card sarkar,subsidy
intercroppingwith tomato,advice
how is the wether todday,weather
is bhav up for tamatar todday?,market
when to boi gehu?,advice
corn markit,market
best seeds for rise,advice
what boi for soyabean?,advice
how is the wether td,weather
gehu me sick lag gaya,disease
WILL IT TEMP TOMOROW?,weather
when to urea dhan?,advice
currentdhan price price,market
medicine for corn bugs,disease
WHATDAP FOR TAMATAR?,advice
baarish tmrw,weather
soybean me spots lag gaya,disease
bank for tractor,subsidy
ISDHOOP COMING,weather
GOVTGOVT FOR WHEAT,subsidy
how much boi for wheat,advice
any chance of baarish tomorrow?,weather
howto save soyabean from sick,disease
rainforecast for punjab,weather
ismkt up for pyaz aaj?,market
bank for tractor,subsidy
current corn pryce pryce,market
how is the heat 2day?,weather
pyazke liye kaun sa boi acha hai?,advice
wedder forecast for punjab,weather
bestpani for cotton,advice
intercropping with tamatar,advice
best dap for tomato,advice
how to save pyaz from dying,disease
bugs dhan help,disease
how much boi for corn,advice
how is the mausam aaj?,weather
PM scheme details,subsidy
should i give water to tamatar today,advice
schemform kaha milega,subsidy
best water for wheet,advice
shouldi give plant to tamatar aaj,advice
TELL ME SOYABEAN MARKET,market
current rise baav baav,market
any chance of barish tmrw?,weather
is there any govt for rice farmers,subsidy
intercroppingwith cotton,advice
sukha onion help,disease
riceme disease lag gaya,disease
howis the baarish 2day?,weather
how much seeds for mustard,advice
spots on tamatar pattiyan,disease
weather tmrw,weather
should i give urea to gehun today?,advice
kisan credit card bank,subsidy
baarish tomorrow,weather
tell me kapas prise,market
heat forecast for punjab,weather
karz status,subsidy
where to sell makka for good markit,market
too much mausam for rise,weather
prise prise for chawal??,market
needscheme for farming,subsidy
how much pani for ganna?,advice
needhelp with cotton water,advice
ANYCHANCE OF TEMP TOMOROW?,weather
aloo me dying lag gaya,disease
should i give dap to soybean 2day?,advice
spots on cotton stem,disease
white powder on tamatar,disease
pm kisan status,subsidy
howmuch dap for makka,advice
spots on aloo jad,disease
will it barish tmrw,weather
right time for tamatar urea,advice
white powder on cotton,disease
my wheat pattiyan are turning yellow,disease
tell me rice price,market
is mosam coming,weather
chawal ke liye kaun sa seeds acha hai,advice
what is the prise of makka aaj?,market
mausam alert needed,weather
best beej for tamatar,advice
intercropping with sugarcane,advice
how much plant for onion,advice
wether forecast for punjab,weather
HOWMUCH UGANA FOR CORN,advice
bugs in aloo,disease
GOVT STATUS,subsidy
RIGHT TIME FOR MUSTARD BEEJ,advice
any chance of weather tomorow,weather
wedder tmrw,weather
mktmkt for chawal,market
where to sell tamatar for good baav,market
HOW TO SAVE SOYBEAN FROM SUKHA,disease
any chance of rain next day,weather
white powder on corn,disease
how much khad for chawal?,advice
WHAT IS THE RET OF SUGARCANE TODDAY?,market
what ugana for rise?,advice
how to save onion from disease,disease
BUGS IN GEHUN,disease
any chance of baarish kal?,weather
anychance of temp tomorrow?,weather
SHOULD I GIVE FERTILIZER TO WHEAT TODAY,advice
kya 2moro mausam hogi,weather
whento dap soyabean?,advice
loan form kaha milega,subsidy
tell me mustard markit,market
how to apply for yojana,subsidy
mustard ka bhav kya hai today?,market
will it dhoop tmrw?,weather
what is the baav of corn todday,market
baarish forecast for punjab,weather
intercropping with pyaz,advice
PM pm kisan details,subsidy
NEED BANK FOR FARMING,subsidy
need yojana for farming,subsidy
what is the paise of chawal aaj?,market
disease attack on sarso,disease
kisan credit card scheme,subsidy
how to apply for yojana,subsidy
too much dhoop for aloo,weather
medicine for sarso sukha,disease
when to seeds cotton?,advice
baarish alert needed,weather
aloo ret,market
WETHER TOMOROW,weather
sell gehu 2day mandi,market
sell onion aaj price,market
how to apply for subsidy,subsidy
white powder on rice,disease
need help with gehu boi,advice
when to boi makka,advice
my soyabean crop are turning yellow,disease
WHEN TO WATER TOMATO,advice
pest makka help,disease
is barish coming?,weather
how much boi for chawal?,advice
when to beej aloo?,advice
medicine for makka dying,disease
GEHUN KA RATE KYA HAI NOW?,market
toomuch mosam for rice,weather
spots on tomato jad,disease
current makka markit markit,market
GANNAKE LIYE KAUN SA KHAD ACHA HAI?,advice
KEEDA ATTACK ON RICE,disease
is prise up for wheat todday?,market
where to sell rise for good pryce,market
is temp coming?,weather
medicine for corn dying,disease
what urea for makka?,advice
needhelp with chawal fertilizer,advice
bestugana for aloo,advice
wheat ke liye kaun sa boi acha hai,advice
spots on soybean tana,disease
spots on mustard pattiyan,disease
mktmkt for chawal,market
when to urea tamatar?,advice
dying mustard help,disease
heat forecast for punjab,weather
gehu ke liye kaun sa grow acha hai?,advice
potato is dying what to do,disease
wheet prise,market
need karz for farming,subsidy
right time for pyaz water,advice
schem for tractor,subsidy
current corn pryce pryce,market
whatis the markit of gehun todday,market
wedder alert needed,weather
kya tomorrow temp hogi?,weather
intercropping with sarso,advice
needkarz for farming,subsidy
bugs gehu help,disease
kya next day wedder hogi,weather
mausam forecast for punjab,weather
pyazmarkit,market
too much baarish for gehu,weather
sugarcane ke liye kaun sa beej acha hai,advice
bestfertilizer for soybean,advice
SHOULD I GIVE BOI TO ALOO TODDAY?,advice
sell rise todday mandi,market
what urea for tomato,advice
how to apply for karz,subsidy
chawalmarket,market
PMschem details,subsidy
kya 2moro mosam hogi?,weather
will it weather 2moro,weather
mausam forecast for punjab,weather
baarishtomorow,weather
mausam 2moro,weather
intercroppingwith soyabean,advice
bank form kaha milega,subsidy
PM bank details,subsidy
medicine for gehu sick,disease
how much beej for tamatar?,advice
kisan credit card scheme,subsidy
what ugana for cotton?,advice
pm kisan status,subsidy
rain forecast for punjab,weather
bugsin wheat,disease
how to apply for schem,subsidy
kisan credit card pm kisan,subsidy
how to apply for schem,subsidy
yellowing soybean help,disease
heat alert needed,weather
sellrise aaj rate,market
intercroppingwith makka,advice
soyabean ka baav kya hai aaj?,market
spots on chawal pattiyan,disease
bugs in mustard,disease
kya tomorow barish hogi?,weather
dhoop kal,weather
when to khad corn?,advice
howto apply for loan,subsidy
bugs in soybean,disease
dhoop alert needed,weather
dying wheet help,disease
spots on wheat crop,disease
wether tmrw,weather
yojana for tractor,subsidy
PM subsidy details,subsidy
temp alert needed,weather
kya kal rain hogi?,weather
right time for corn pani,advice
barish forecast for punjab,weather
SPOTS ON MUSTARD ROOT,disease
when to beej aloo?,advice
BANK FOR TRACTOR,subsidy
govt yojana for rise,subsidy
tell me makka paise,market
bugsin pyaz,disease
intercroppingwith gehun,advice
will it mausam 2moro?,weather
rise me dry lag gaya,disease
how is the temp td,weather
potato me keeda lag gaya,disease
how is the mosam 2day?,weather
WILLIT TEMP 2MORO?,weather
right time for mustard boi,advice
BAARISH FORECAST FOR PUNJAB,weather
dhanbaav,market
need help with tamatar seeds,advice
yojanastatus,subsidy
is there any schem for tamatar farmers?,subsidy
bugs attack on ganna,disease
MAKKA RATE,market
wheet markit,market
how to save chawal from bugs,disease
rise me bimari lag gaya,disease
barish next day,weather
tell me kapas prise,market
subsidy status,subsidy
mymakka root are turning yellow,disease
govtschem for soyabean,subsidy
potato rate,market
is price up for kapas now?,market
sugarcane ret,market
intercropping with mustard,advice
sabsidi for tractor,subsidy
govt schem for wheat,subsidy
should i give ugana to kanak aaj?,advice
govt sabsidi for gehu,subsidy
should i give grow to mustard 2day?,advice
current sarso mandi mandi,market
medicine for rise bimari,disease
wheat ret,market
when to urea rise?,advice
ismosam coming?,weather
how much khad for makka?,advice
spots on chawal fasal,disease
IS DHOOP COMING?,weather
NEED SUBSIDY FOR FARMING,subsidy
WHEN TO PANI SOYBEAN,advice
is there any pm kisan for gehu farmers,subsidy
mausam alert needed,weather
tomato paise,market
need sabsidi for farming,subsidy
BAARISH ALERT NEEDED,weather
ganna is dying what to do,disease
how to save kapas from dry,disease
bugs attack on wheat,disease
current kanak prise prise,market
mosam kal,weather
temp forecast for punjab,weather
current kapas markit markit,market
tell me sarso bhav,market
temp tomorow,weather
dry attack on aloo,disease
KISAN CREDIT CARD KARZ,subsidy
whento fertilizer chawal?,advice
weatherforecast for punjab,weather
should i give boi to dhan now?,advice
what urea for sarso?,advice
will it dhoop tomorrow?,weather
mausam forecast for punjab,weather
GOVTSCHEM FOR ONION,subsidy
kya tomorow baarish hogi,weather
bhav bhav for chawal,market
where to sell gehun for good market,market
intercropping with pyaz,advice
current tomato rate rate,market
tell me rice mandi,market
need help with tamatar water,advice
what is the market of potato today?,market
sarkar form kaha milega,subsidy
isthere any subsidy for pyaz farmers,subsidy
HOW TO APPLY FOR GOVT,subsidy
bimari kanak help,disease
should i give khad to sugarcane now?,advice
too much mosam for wheat,weather
BUGS IN KANAK,disease
tell me pyaz rate,market
kisan credit card scheme,subsidy
kapas ke liye kaun sa grow acha hai?,advice
how to save rice from keeda,disease
dhoop alert needed,weather
how to apply for loan,subsidy
PM BANK DETAILS,subsidy
where to sell soyabean for good rate,market
how is the mosam td?,weather
spotson corn leaves,disease
what dap for soyabean?,advice
any chance of wether kal,weather
is heat coming?,weather
IS BARISH COMING?,weather
dhan ke liye kaun sa boi acha hai?,advice
need schem for farming,subsidy
kya kal wether hogi,weather
WHITEPOWDER ON COTTON,disease
is there any subsidy for gehu farmers,subsidy
howto save sugarcane from yellowing,disease
weather forecast for punjab,weather
potatome sukha lag gaya,disease
spotson gehun pattiyan,disease
kapas me keeda lag gaya,disease
what is the markit of ganna todday,market
yojana status,subsidy
medicine for makka dying,disease
whitepowder on tamatar,disease
BUGSIN MAKKA,disease
is mosam coming?,weather
wheatme sick lag gaya,disease
best ugana for kapas,advice
SCHEM FOR TRACTOR,subsidy
bugssarso help,disease
righttime for mustard grow,advice
will it weather 2moro?,weather
bimari attack on soyabean,disease
ganna ke liye kaun sa plant acha hai?,advice
INTERCROPPING WITH RISE,advice
need yojana for farming,subsidy
mandi mandi for rice,market
intercropping with chawal,advice
PM scheme details,subsidy
how to save wheet from keeda,disease
where to sell tamatar for good markit,market
schem form kaha milega,subsidy
govtsabsidi for cotton,subsidy
HOWIS THE WETHER TD?,weather
need help with potato urea,advice
gehun me dry lag gaya,disease
tell me wheet bhav,market
current chawal markit markit,market
willit dhoop tomorrow,weather
how is the mausam aaj?,weather
my sugarcane root are turning yellow,disease
medicine for wheat keeda,disease
will it wether kal?,weather
right time for corn plant,advice
should i give fertilizer to tomato now?,advice
where to sell kanak for good mandi,market
pyaz me bimari lag gaya,disease
too much wedder for aloo,weather
right time for soyabean urea,advice
should i give grow to makka td,advice
how to apply for pm kisan,subsidy
mustard ka mandi kya hai todday?,market
yojanafor tractor,subsidy
IS PRYCE UP FOR MUSTARD NOW?,market
subsidy form kaha milega,subsidy
any chance of barish tomorrow?,weather
sabsidi status,subsidy
soybean ka price kya hai aaj,market
intercroppingwith pyaz,advice
mosam alert needed,weather
baarish 2moro,weather
bugs in cotton,disease
ganna ka price kya hai td?,market
what beej for potato?,advice
is mandi up for ganna todday?,market
best seeds for soyabean,advice
how to apply for scheme,subsidy
whatdap for chawal?,advice
my corn root are turning yellow,disease
wether alert needed,weather
when to grow rice,advice
WHAT IS THE RET OF POTATO NOW,market
howis the baarish td?,weather
disease attack on potato,disease
paisepaise for kapas??,market
should i give beej to tomato td,advice
when to fertilizer soybean?,advice
kya tomorrow baarish hogi,weather
dhoop forecast for punjab,weather
PM yojana details,subsidy
intercropping with wheat,advice
how much water for tomato?,advice
tamataris dying what to do,disease
wheat ke liye kaun sa khad acha hai?,advice
spots on tomato fasal,disease
current sugarcane market market,market
wheat is dying what to do,disease
bankfor tractor,subsidy
how to apply for subsidy,subsidy
needloan for farming,subsidy
bugs in kanak,disease
sell gehun todday price,market
govt yojana for wheat,subsidy
spots soyabean help,disease
TELL ME KANAK MARKIT,market
white powder on makka,disease
kya2moro temp hogi?,weather
best fertilizer for wheat,advice
is mausam coming?,weather
my kapas root are turning yellow,disease
RIGHTTIME FOR TOMATO DAP,advice
white powder on mustard,disease
whereto sell tamatar for good prise,market
wheet is dying what to do,disease
my gehu root are turning yellow,disease
righttime for tamatar boi,advice
current wheet mkt mkt,market
HOWMUCH UGANA FOR SOYBEAN,advice
my sarso crop are turning yellow,disease
rain forecast for punjab,weather
kisan credit card schem,subsidy
best fertilizer for corn,advice
sabsidi for tractor,subsidy
my sarso crop are turning yellow,disease
will it mausam kal,weather
aloo ke liye kaun sa plant acha hai?,advice
bankfor tractor,subsidy
need help with sugarcane beej,advice
HOWMUCH PLANT FOR MUSTARD,advice
isthere any govt for kapas farmers,subsidy
how to apply for subsidy,subsidy
WILL IT TEMP TOMOROW,weather
intercroppingwith gehu,advice
whitepowder on corn,disease
bugs in mustard,disease
karz for tractor,subsidy
need yojana for farming,subsidy
when to seeds corn?,advice
need help with corn boi,advice
rice ka paise kya hai aaj?,market
is there any sarkar for sarso farmers?,subsidy
intercropping with corn,advice
govt loan for rise,subsidy
anychance of barish tomorow?,weather
loanstatus,subsidy
current pyaz ret ret,market
what boi for kapas?,advice
kisan credit card pm kisan,subsidy
KAPAS IS DYING WHAT TO DO,disease
whatseeds for soyabean,advice
wheatke liye kaun sa beej acha hai?,advice
wether alert needed,weather
MY GEHU PATTIYAN ARE TURNING YELLOW,disease
how much urea for aloo?,advice
is there any scheme for soyabean farmers?,subsidy
sell wheat td paise,market
IS HEAT COMING?,weather
sabsidi for tractor,subsidy
schem for tractor,subsidy
kyanext day dhoop hogi,weather
is rain coming?,weather
whatis the price of makka now?,market
any chance of mosam next day,weather
spots on gehun crop,disease
kya tomorow rain hogi,weather
will it wedder tomorrow,weather
WHAT GROW FOR TOMATO,advice
karz status,subsidy
rise is dying what to do,disease
when to water soyabean?,advice
anychance of heat kal?,weather
HEATFORECAST FOR PUNJAB,weather
rice is dying what to do,disease
medicinefor wheat bugs,disease
pm kisan status,subsidy
too much temp for cotton,weather
onionis dying what to do,disease
tomato paise,market
TELL ME GANNA MANDI,market
shouldi give boi to tamatar aaj?,advice
where to sell onion for good prise,market
kisan credit card karz,subsidy
any chance of dhoop tomorrow?,weather
spots on dhan fasal,disease
is baarish coming?,weather
how is the baarish aaj,weather
markit markit for sarso??,market
pyazme disease lag gaya,disease
is rain coming,weather
white powder on wheat,disease
tell me ganna ret,market
how is the baarish now?,weather
SHOULD I GIVE SEEDS TO GANNA AAJ?,advice
what is the ret of mustard td?,market
temp alert needed,weather
disease gehu help,disease
mausam forecast for punjab,weather
right time for pyaz fertilizer,advice
yellowing kapas help,disease
spotson kapas pattiyan,disease
medicine for chawal spots,disease
PM bank details,subsidy
best plant for aloo,advice
yellowing gehun help,disease
ismausam coming?,weather
govt govt for wheat,subsidy
bhav bhav for sugarcane??,market
need help with pyaz plant,advice
MEDICINEFOR SUGARCANE BIMARI,disease
sugarcane price,market
baav baav for gehu??,market
SOYBEAN IS DYING WHAT TO DO,disease
govt schem for kapas,subsidy
spots on wheet root,disease
what beej for pyaz?,advice
will it heat kal?,weather
how much pani for corn?,advice
current soybean baav baav,market
kya 2moro weather hogi?,weather
SELL GEHU TODDAY RET,market
what fertilizer for rise?,advice
when to urea cotton?,advice
bugs in chawal,disease
whereto sell rice for good ret,market
needhelp with soybean grow,advice
how much water for wheet,advice
tell me soyabean markit,market
dhanbhav,market
sarkar form kaha milega,subsidy
PM sabsidi details,subsidy
is mkt up for soybean 2day?,market
what is the markit of cotton aaj?,market
sell onion today mandi,market
need help with rice boi,advice
sell rice aaj rate,market
yojana for tractor,subsidy
need sarkar for farming,subsidy
is there any sabsidi for sugarcane farmers,subsidy
bugs in sugarcane,disease
what is the baav of pyaz td?,market
ganna me sukha lag gaya,disease
weather forecast for punjab,weather
PM loan details,subsidy
tellme soybean baav,market
PM subsidy details,subsidy
scheme form kaha milega,subsidy
medicinefor rise sick,disease
LOAN STATUS,subsidy
KISAN CREDIT CARD SCHEME,subsidy
loan form kaha milega,subsidy
is wether coming?,weather
bugs in rice,disease
pm kisan form kaha milega,subsidy
how much dap for gehu?,advice
tell me sugarcane paise,market
currentrise mkt mkt,market
wedderalert needed,weather
need help with makka grow,advice
medicine for wheet dying,disease
current cotton ret ret,market
how much fertilizer for gehun?,advice
bugs in kanak,disease
current rise prise prise,market
intercropping with dhan,advice
tamatarme sick lag gaya,disease
shouldi give fertilizer to aloo 2day?,advice
spots on kapas root,disease
sellwheet td price,market
any chance of mausam 2moro,weather
intercroppingwith tamatar,advice
how much khad for soyabean?,advice
ANY CHANCE OF MAUSAM TOMOROW?,weather
my cotton root are turning yellow,disease
where to sell makka for good markit,market
is markit up for soybean todday?,market
barish tomorrow,weather
BAAVBAAV FOR WHEET??,market
intercropping with soyabean,advice
bugs in corn,disease
BARISH ALERT NEEDED,weather
PM scheme details,subsidy
MEDICINEFOR COTTON SUKHA,disease
PMKARZ DETAILS,subsidy
my soyabean pattiyan are turning yellow,disease
GEHU KA BAAV KYA HAI NOW?,market
right time for tamatar dap,advice
howto save mustard from sick,disease
shouldi give ugana to kapas now,advice
will it wether kal?,weather
is market up for potato 2day?,market
sell mustard aaj mkt,market
right time for makka beej,advice
kisan credit card subsidy,subsidy
right time for soyabean ugana,advice
PM karz details,subsidy
need help with sarso plant,advice
needyojana for farming,subsidy
when to fertilizer onion?,advice
needsabsidi for farming,subsidy
tell me dhan mkt,market
PM scheme details,subsidy
kya 2moro barish hogi?,weather
PM govt details,subsidy
how much boi for potato?,advice
any chance of mosam tmrw,weather
KISAN CREDIT CARD LOAN,subsidy
best boi for soybean,advice
wedderalert needed,weather
WILL IT TEMP TOMORROW,weather
dhan ke liye kaun sa beej acha hai?,advice
govt for tractor,subsidy
wedder alert needed,weather
howmuch urea for ganna,advice
how to apply for bank,subsidy
howmuch plant for pyaz?,advice
WHEN TO KHAD SOYBEAN?,advice
tomato is dying what to do,disease
riseka paise kya hai aaj,market
shouldi give pani to tomato 2day,advice
karz form kaha milega,subsidy
need help with makka beej,advice
need help with aloo pani,advice
is mausam coming,weather
onion ke liye kaun sa ugana acha hai?,advice
govt loan for rice,subsidy
bankstatus,subsidy
isthere any govt for kanak farmers?,subsidy
isbarish coming?,weather
sukha attack on cotton,disease
where to sell pyaz for good rate,market
howto apply for govt,subsidy
is there any scheme for soyabean farmers?,subsidy
sugarcanepryce,market
where to sell ganna for good paise,market
makka paise,market
kya 2moro dhoop hogi?,weather
tell me gehu bhav,market
pm kisan form kaha milega,subsidy
how is the dhoop now?,weather
spotson corn stem,disease
cotton ke liye kaun sa pani acha hai,advice
kisan credit card scheme,subsidy
what is the markit of sugarcane todday?,market
any chance of baarish 2moro?,weather
is mkt up for kapas 2day?,market
bugsin potato,disease
sabsidi form kaha milega,subsidy
shouldi give water to sugarcane td?,advice
sell sugarcane now paise,market
is wedder coming?,weather
how much dap for pyaz?,advice
tomato ke liye kaun sa khad acha hai?,advice
raintomorrow,weather
RIGHT TIME FOR KAPAS WATER,advice
rise ka pryce kya hai 2day,market
should i give urea to aloo 2day?,advice
soybean ka markit kya hai 2day?,market
WHITE POWDER ON TAMATAR,disease
need help with mustard seeds,advice
subsidy status,subsidy
sell rice todday bhav,market
corn ka market kya hai td?,market
KYA TOMORROW WEATHER HOGI?,weather
dying attack on gehu,disease
IS TEMP COMING,weather
bimari attack on soyabean,disease
mausam forecast for punjab,weather
kya kal weather hogi?,weather
govtbank for rise,subsidy
will it dhoop tmrw,weather
is mkt up for onion todday?,market
makka ke liye kaun sa khad acha hai?,advice
KAPAS ME YELLOWING LAG GAYA,disease
spots on tamatar stem,disease
kanak ke liye kaun sa seeds acha hai?,advice
medicine for wheat dying,disease
white powder on tamatar,disease
kisan credit card schem,subsidy
schemfor tractor,subsidy
bestbeej for kanak,advice
sell aloo today pryce,market
should i give boi to rice td,advice
govtkarz for gehun,subsidy
subsidy status,subsidy
kisancredit card subsidy,subsidy
need subsidy for farming,subsidy
righttime for corn khad,advice
SPOTS ON DHAN ROOT,disease
too much baarish for rise,weather
current chawal prise prise,market
PM pm kisan details,subsidy
will it weather next day?,weather
paise paise for corn??,market
what is the bhav of mustard now,market
is mosam coming,weather
schem status,subsidy
kisan credit card pm kisan,subsidy
howto save gehun from bugs,disease
how to apply for yojana,subsidy
kisan credit card loan,subsidy
WHEN TO FERTILIZER CHAWAL?,advice
how to save kanak from spots,disease
tamatar ke liye kaun sa ugana acha hai?,advice
howis the mosam todday?,weather
medicine for kapas spots,disease
sellrise todday baav,market
how is the dhoop now,weather
IS BARISH COMING?,weather
mausam forecast for punjab,weather
kisan credit card bank,subsidy
best water for tamatar,advice
pm kisan form kaha milega,subsidy
need help with kanak boi,advice
karz form kaha milega,subsidy
need schem for farming,subsidy
howmuch plant for tamatar?,advice
right time for kapas fertilizer,advice
should i give boi to ganna td?,advice
bimari rise help,disease
govt subsidy for rice,subsidy
needschem for farming,subsidy
govt karz for wheat,subsidy
kisan credit card loan,subsidy
how is the weather now,weather
current kanak pryce pryce,market
right time for onion water,advice
when to khad chawal?,advice
rate rate for cotton??,market
is baarish coming,weather
need help with sugarcane plant,advice
tellme wheat markit,market
shouldi give beej to aloo now?,advice
soyabean ke liye kaun sa pani acha hai?,advice
