text,intent
what boi for ganna?,advice
how is the mosam td?,weather
need bank for farming,subsidy
govt scheme for tomato,subsidy
kya kal temp hogi?,weather
MEDICINE FOR MAKKA BIMARI,disease
where to sell soyabean for good mandi,market
how to apply for pm kisan,subsidy
how much grow for gehun?,advice
bugs in tamatar,disease
SELL MUSTARD TODDAY MARKET,market
right time for corn seeds,advice
bugs in aloo,disease
WETHER TOMORROW,weather
kisan credit card govt,subsidy
mustardme dry lag gaya,disease
what is the paise of sarso todday?,market
KEEDADHAN HELP,disease
how is the rain todday,weather
bimarisarso help,disease
bugsattack on tomato,disease
SPOTSON COTTON STEM,disease
WILL IT MOSAM KAL?,weather
rate rate for wheat??,market
will it rain next day?,weather
kisan credit card govt,subsidy
HOW IS THE WEATHER 2DAY?,weather
should i give pani to soyabean td?,advice
MAUSAMTMRW,weather
kisan credit card bank,subsidy
howmuch fertilizer for cotton?,advice
dhan is dying what to do,disease
my potato fasal are turning yellow,disease
prise prise for wheet??,market
govt form kaha milega,subsidy
weather forecast for punjab,weather
spots attack on sugarcane,disease
isthere any sabsidi for kapas farmers,subsidy
spots on tomato leaves,disease
tellme sarso price,market
needhelp with kanak pani,advice
market market for soyabean??,market
how to apply for scheme,subsidy
bestwater for sarso,advice
spots on potato stem,disease
best beej for ganna,advice
current makka price price,market
mkt mkt for kapas??,market
temp alert needed,weather
baarishforecast for punjab,weather
govt scheme for gehun,subsidy
sukha tamatar help,disease
righttime for makka urea,advice
kya kal baarish hogi,weather
mywheet tana are turning yellow,disease
is mausam coming,weather
how is the baarish todday?,weather
sarkar form kaha milega,subsidy
tomato ka market kya hai today,market
what is the mandi of kapas now?,market
is wether coming,weather
when to khad soybean,advice
diseasemustard help,disease
chawal ka pryce kya hai now?,market
spots on gehu leaves,disease
ispaise up for dhan 2day?,market
needpm kisan for farming,subsidy
tempalert needed,weather
govt pm kisan for kanak,subsidy
best urea for gehu,advice
when to plant wheet?,advice
kya2moro mausam hogi,weather
IS THERE ANY YOJANA FOR PYAZ FARMERS?,subsidy
spots on sugarcane fasal,disease
weather alert needed,weather
medicinefor gehu pest,disease
WHEN TO SEEDS POTATO,advice
PM karz details,subsidy
WHITEPOWDER ON TAMATAR,disease
will it dhoop tmrw?,weather
wether alert needed,weather
rice ke liye kaun sa beej acha hai,advice
white powder on mustard,disease
how to save dhan from keeda,disease
PM subsidy details,subsidy
IS RET UP FOR SOYBEAN TD?,market
sugarcane is dying what to do,disease
is bhav up for gehun now?,market
need loan for farming,subsidy
tell me cotton markit,market
is mausam coming?,weather
spots on gehu pattiyan,disease
what ugana for mustard?,advice
how much seeds for sugarcane?,advice
baarish tmrw,weather
right time for sarso grow,advice
mandi mandi for dhan??,market
how is the weather today,weather
white powder on soyabean,disease
too much dhoop for tamatar,weather
howto apply for subsidy,subsidy
kisan credit card yojana,subsidy
needsabsidi for farming,subsidy
subsidystatus,subsidy
keeda attack on aloo,disease
is mosam coming,weather
bestplant for makka,advice
bugs ganna help,disease
right time for rise dap,advice
rise is dying what to do,disease
kya tomorrow weather hogi?,weather
shouldi give dap to ganna today?,advice
best plant for rice,advice
kya tomorow dhoop hogi?,weather
best pani for kanak,advice
need help with tomato plant,advice
white powder on corn,disease
currentgehu price price,market
whatis the ret of potato today?,market
govt for tractor,subsidy
rain tomorrow,weather
NEED HELP WITH WHEET DAP,advice
how much ugana for kapas?,advice
how to apply for govt,subsidy
how much pani for pyaz?,advice
rise is dying what to do,disease
govt sarkar for pyaz,subsidy
TOO MUCH BAARISH FOR RISE,weather
kisancredit card yojana,subsidy
BIMARI TOMATO HELP,disease
onion ke liye kaun sa seeds acha hai,advice
schem status,subsidy
bhav bhav for kapas??,market
is temp coming?,weather
is wedder coming?,weather
any chance of mosam tomorrow?,weather
sellonion now market,market
will it mosam kal?,weather
govt scheme for rise,subsidy
too much mausam for pyaz,weather
bugs in onion,disease
kya tomorow barish hogi?,weather
best urea for mustard,advice
intercroppingwith soybean,advice
karz for tractor,subsidy
gehun prise,market
SPOTS ON GEHUN FASAL,disease
isbaarish coming?,weather
sell chawal today mkt,market
sell kapas now prise,market
wheetme disease lag gaya,disease
subsidy form kaha milega,subsidy
when to grow kapas,advice
is price up for chawal now,market
diseaseattack on sarso,disease
kisan credit card yojana,subsidy
PM subsidy details,subsidy
govt scheme for wheat,subsidy
kya 2moro mausam hogi?,weather
IS THERE ANY YOJANA FOR ALOO FARMERS,subsidy
intercroppingwith gehu,advice
when to fertilizer gehun?,advice
righttime for kapas khad,advice
will it heat tmrw,weather
rice me dying lag gaya,disease
bugs in soyabean,disease
howto apply for sarkar,subsidy
should i give urea to pyaz today?,advice
how to save soybean from keeda,disease
what is the ret of sarso now?,market
prise prise for soybean,market
bank for tractor,subsidy
baarish tmrw,weather
sabsidi form kaha milega,subsidy
gehunrate,market
wether kal,weather
need schem for farming,subsidy
heat forecast for punjab,weather
kya next day mosam hogi?,weather
bugsin gehu,disease
govt govt for soybean,subsidy
WHEAT MARKIT,market
wheet is dying what to do,disease
intercropping with sugarcane,advice
any chance of wedder tomorow,weather
baav baav for soyabean,market
bugsin soyabean,disease
bugs in makka,disease
medicine for aloo sukha,disease
bugs attack on gehu,disease
kisan credit card schem,subsidy
what is the price of wheat 2day?,market
right time for mustard grow,advice
where to sell makka for good markit,market
ANY CHANCE OF RAIN TOMORROW?,weather
schemefor tractor,subsidy
what is the pryce of chawal today?,market
bugs in kanak,disease
medicinefor wheet pest,disease
PM YOJANA DETAILS,subsidy
pest wheet help,disease
loan for tractor,subsidy
best grow for kapas,advice
kya tmrw barish hogi,weather
current kapas baav baav,market
subsidy form kaha milega,subsidy
how is the dhoop aaj?,weather
PM loan details,subsidy
mausam forecast for punjab,weather
white powder on gehu,disease
my aloo crop are turning yellow,disease
where to sell chawal for good markit,market
howto save mustard from dying,disease
too much weather for potato,weather
best ugana for kapas,advice
kisancredit card scheme,subsidy
toomuch wether for gehun,weather
weather alert needed,weather
sukha pyaz help,disease
willit weather tomorrow?,weather
right time for pyaz seeds,advice
is there any scheme for corn farmers?,subsidy
what is the price of tomato todday?,market
whento grow tomato?,advice
IS MAUSAM COMING?,weather
tell me ganna bhav,market
how to save gehu from keeda,disease
willit baarish next day,weather
wheetis dying what to do,disease
need schem for farming,subsidy
my soyabean tana are turning yellow,disease
what urea for makka,advice
sell aloo 2day pryce,market
right time for kapas beej,advice
WETHER ALERT NEEDED,weather
right time for soyabean urea,advice
should i give ugana to mustard now?,advice
where to sell gehun for good mandi,market
will it mausam tomorow?,weather
need sabsidi for farming,subsidy
righttime for mustard plant,advice
too much mausam for soyabean,weather
wetheralert needed,weather
MEDICINEFOR SARSO SPOTS,disease
mosam tmrw,weather
what is the bhav of dhan td?,market
rainalert needed,weather
KAPAS RATE,market
PM loan details,subsidy
mosam forecast for punjab,weather
where to sell kapas for good paise,market
pm kisan status,subsidy
what is the pryce of corn now?,market
heat forecast for punjab,weather
medicine for ganna dry,disease
what plant for kanak?,advice
sarsoka ret kya hai today?,market
bankform kaha milega,subsidy
IS MAUSAM COMING?,weather
medicine for soyabean bimari,disease
my chawal crop are turning yellow,disease
DRY ATTACK ON SOYABEAN,disease
barish alert needed,weather
tell me soybean mandi,market
cotton ka market kya hai now,market
PM KISAN FOR TRACTOR,subsidy
gehunka markit kya hai now?,market
is there any karz for ganna farmers?,subsidy
need help with rice urea,advice
how to save sugarcane from keeda,disease
ismarket up for kanak now,market
KISANCREDIT CARD KARZ,subsidy
SCHEME STATUS,subsidy
BUGS ATTACK ON KANAK,disease
where to sell kanak for good mkt,market
is price up for makka today?,market
anychance of baarish next day,weather
white powder on kapas,disease
is price up for ganna td?,market
sarkar form kaha milega,subsidy
need bank for farming,subsidy
when to beej sugarcane?,advice
isthere any yojana for chawal farmers,subsidy
marketmarket for tamatar??,market
where to sell gehu for good pryce,market
HOW IS THE BAARISH TD?,weather
intercropping with sarso,advice
PESTATTACK ON GANNA,disease
white powder on sugarcane,disease
kya kal mosam hogi?,weather
how to apply for govt,subsidy
will it temp 2moro,weather
kisan credit card sarkar,subsidy
is ret up for mustard now?,market
right time for ganna seeds,advice
baarish alert needed,weather
isthere any subsidy for onion farmers?,subsidy
pm kisan form kaha milega,subsidy
any chance of weather tmrw?,weather
heat alert needed,weather
what ugana for corn,advice
should i give boi to potato 2day,advice
tell me chawal rate,market
my chawal fasal are turning yellow,disease
best water for soyabean,advice
how much seeds for rise?,advice
need pm kisan for farming,subsidy
sarsois dying what to do,disease
ISTHERE ANY KARZ FOR SOYBEAN FARMERS?,subsidy
weather forecast for punjab,weather
bimari attack on ganna,disease
mktmkt for makka??,market
sell rice todday ret,market
whereto sell gehun for good markit,market
KYA 2MORO MOSAM HOGI?,weather
how much fertilizer for tamatar?,advice
whitepowder on corn,disease
PM SARKAR DETAILS,subsidy
how to save cotton from yellowing,disease
karz for tractor,subsidy
howto save mustard from sukha,disease
bugs in soyabean,disease
WEATHER FORECAST FOR PUNJAB,weather
dhoop tomorow,weather
is there any loan for mustard farmers?,subsidy
any chance of wedder tomorow?,weather
soyabean ka mkt kya hai td,market
currentsugarcane paise paise,market
bugs attack on mustard,disease
loan status,subsidy
white powder on makka,disease
need karz for farming,subsidy
need help with mustard fertilizer,advice
soybean price,market
IS THERE ANY SABSIDI FOR POTATO FARMERS?,subsidy
kisan credit card govt,subsidy
ANYCHANCE OF TEMP NEXT DAY,weather
my makka fasal are turning yellow,disease
medicine for chawal keeda,disease
scheme form kaha milega,subsidy
is heat coming?,weather
weatheralert needed,weather
when to water corn,advice
medicine for soybean bimari,disease
subsidy form kaha milega,subsidy
too much rain for gehun,weather
howis the mausam now,weather
RIGHTTIME FOR COTTON BOI,advice
any chance of heat kal?,weather
sellcotton aaj ret,market
MEDICINE FOR ALOO BUGS,disease
BUGS IN GANNA,disease
spots on tomato tana,disease
rain forecast for punjab,weather
spots on wheat crop,disease
dhanmarkit,market
howto apply for loan,subsidy
is wedder coming,weather
how to apply for scheme,subsidy
WHEAT ME YELLOWING LAG GAYA,disease
is rate up for wheet today?,market
bestbeej for soyabean,advice
whereto sell wheet for good pryce,market
should i give boi to gehun now?,advice
howto save mustard from sukha,disease
white powder on rise,disease
kyatomorrow mausam hogi,weather
LOANFORM KAHA MILEGA,subsidy
rice ke liye kaun sa fertilizer acha hai?,advice
KYA TOMOROW HEAT HOGI?,weather
spots on kapas fasal,disease
pm kisan form kaha milega,subsidy
makka ke liye kaun sa khad acha hai?,advice
sell wheat td prise,market
current makka markit markit,market
bhav bhav for rise??,market
right time for kanak ugana,advice
how to save sugarcane from yellowing,disease
should i give urea to chawal now?,advice
how to save potato from pest,disease
should i give boi to mustard aaj?,advice
my tamatar crop are turning yellow,disease
sell tamatar today pryce,market
what is the price of aloo todday?,market
mymustard crop are turning yellow,disease
medicinefor wheet disease,disease
govt bank for rice,subsidy
dying kapas help,disease
govt govt for dhan,subsidy
when to seeds mustard?,advice
where to sell soyabean for good ret,market
gehunka baav kya hai td,market
MYSOYBEAN JAD ARE TURNING YELLOW,disease
rate rate for onion??,market
how much khad for makka,advice
medicine for ganna dying,disease
kisan credit card sabsidi,subsidy
any chance of wedder tmrw?,weather
prise prise for aloo,market
RIGHT TIME FOR WHEAT PANI,advice
BUGS IN POTATO,disease
makka ke liye kaun sa pani acha hai?,advice
how much urea for sarso,advice
current chawal paise paise,market
WHENTO GROW RISE?,advice
best ugana for sugarcane,advice
my cotton fasal are turning yellow,disease
karzfor tractor,subsidy
yellowing attack on corn,disease
bugs in chawal,disease
bank status,subsidy
howis the wedder aaj,weather
spots on soyabean tana,disease
is wedder coming,weather
chawalke liye kaun sa grow acha hai?,advice
LOAN FOR TRACTOR,subsidy
is bhav up for tamatar aaj?,market
SHOULD I GIVE PANI TO SUGARCANE 2DAY?,advice
how much grow for dhan?,advice
wedder tomorow,weather
priseprise for gehu??,market
should i give khad to chawal todday,advice
medicine for onion keeda,disease
WHITE POWDER ON TOMATO,disease
need help with aloo khad,advice
when to water rice?,advice
weather alert needed,weather
is paise up for ganna td?,market
disease attack on pyaz,disease
my cotton crop are turning yellow,disease
WHAT IS THE MKT OF GEHU TODAY?,market
currentchawal pryce pryce,market
onionka price kya hai 2day?,market
any chance of temp next day?,weather
sarkar status,subsidy
WILL IT WEDDER TMRW?,weather
PYAZ KA BAAV KYA HAI TODAY?,market
ismausam coming?,weather
anychance of wedder tomorow?,weather
raterate for corn,market
PM yojana details,subsidy
wedder 2moro,weather
any chance of wedder tomorow?,weather
right time for soybean seeds,advice
need subsidy for farming,subsidy
karzstatus,subsidy
soybeanka prise kya hai today?,market
rise ka paise kya hai today?,market
needhelp with sarso fertilizer,advice
is mausam coming?,weather
prise prise for soybean,market
is dhoop coming,weather
howto save kanak from sukha,disease
what is the pryce of sugarcane now?,market
will it baarish tmrw,weather
is mandi up for gehu aaj?,market
needhelp with aloo fertilizer,advice
need help with tamatar plant,advice
right time for mustard urea,advice
my rice stem are turning yellow,disease
subsidy status,subsidy
sarkarform kaha milega,subsidy
kisan credit card sabsidi,subsidy
RIGHT TIME FOR GANNA UREA,advice
MUSTARD KA BHAV KYA HAI AAJ?,market
need help with tomato ugana,advice
mytamatar jad are turning yellow,disease
rice ke liye kaun sa beej acha hai?,advice
righttime for potato ugana,advice
how is the mausam aaj?,weather
kisan credit card karz,subsidy
sell corn 2day paise,market
need help with onion grow,advice
whatwater for makka?,advice
how to save wheet from pest,disease
howmuch boi for kapas?,advice
bugs in kanak,disease
best seeds for soybean,advice
dhan pryce,market
dry attack on gehu,disease
best plant for mustard,advice
keeda soybean help,disease
currenttamatar mandi mandi,market
govt sabsidi for sugarcane,subsidy
is wether coming?,weather
PM sabsidi details,subsidy
white powder on rice,disease
INTERCROPPING WITH DHAN,advice
what water for tomato?,advice
where to sell sarso for good paise,market
rain alert needed,weather
is mkt up for ganna 2day?,market
how to save gehun from bugs,disease
spots on potato root,disease
sick attack on rise,disease
willit wedder tmrw?,weather
prise prise for tomato??,market
right time for cotton urea,advice
whento grow makka?,advice
kya 2moro weather hogi?,weather
BEST DAP FOR PYAZ,advice
WETHER TMRW,weather
what khad for kanak?,advice
best beej for cotton,advice
how to apply for sabsidi,subsidy
GEHUNIS DYING WHAT TO DO,disease
govt schem for aloo,subsidy
PM sarkar details,subsidy
sell corn td pryce,market
how to save pyaz from sick,disease
pest attack on tamatar,disease
where to sell chawal for good ret,market
whento beej sugarcane,advice
white powder on makka,disease
intercropping with aloo,advice
GOVT PM KISAN FOR POTATO,subsidy
shouldi give fertilizer to tamatar aaj?,advice
spots on tomato root,disease
how to save gehu from disease,disease
current potato market market,market
ANY CHANCE OF BAARISH 2MORO?,weather
what is the prise of tamatar today,market
what is the paise of soybean today,market
kisan credit card bank,subsidy
tempalert needed,weather
tamatar ka price kya hai now?,market
how to apply for pm kisan,subsidy
medicine for wheet yellowing,disease
govt pm kisan for wheat,subsidy
PM schem details,subsidy
is there any scheme for chawal farmers?,subsidy
bestdap for wheat,advice
sell makka td baav,market
need subsidy for farming,subsidy
my rise crop are turning yellow,disease
TEMP ALERT NEEDED,weather
what grow for chawal?,advice
where to sell soybean for good rate,market
makkais dying what to do,disease
scheme for tractor,subsidy
baarish forecast for punjab,weather
is there any yojana for potato farmers?,subsidy
any chance of heat tomorow,weather
PM SUBSIDY DETAILS,subsidy
where to sell sarso for good pryce,market
white powder on wheet,disease
subsidy form kaha milega,subsidy
where to sell chawal for good markit,market
needhelp with kanak boi,advice
soyabeanme keeda lag gaya,disease
PM sarkar details,subsidy
pm kisan for tractor,subsidy
makka ka rate kya hai todday,market
whaturea for makka?,advice
BAARISHNEXT DAY,weather
dry gehun help,disease
what is the market of makka now?,market
sabsidi form kaha milega,subsidy
ret ret for tamatar??,market
govt govt for corn,subsidy
how to save makka from dying,disease
rate rate for makka??,market
white powder on kapas,disease
keeda attack on chawal,disease
sarso me bugs lag gaya,disease
SHOULDI GIVE FERTILIZER TO GANNA NOW,advice
howis the temp td?,weather
how to save tamatar from disease,disease
subsidy form kaha milega,subsidy
wether forecast for punjab,weather
when to fertilizer gehu?,advice
karz for tractor,subsidy
my onion crop are turning yellow,disease
tellme corn markit,market
sell tomato td markit,market
disease attack on gehun,disease
how to save makka from sukha,disease
what urea for soyabean?,advice
DRY ATTACK ON DHAN,disease
how much water for mustard,advice
loan for tractor,subsidy
soyabeanke liye kaun sa khad acha hai?,advice
PM pm kisan details,subsidy
too much wedder for tomato,weather
how much ugana for ganna?,advice
temptmrw,weather
govt pm kisan for rice,subsidy
cotton ke liye kaun sa dap acha hai?,advice
pyazprice,market
white powder on kapas,disease
sarkarfor tractor,subsidy
dhoop forecast for punjab,weather
pyazke liye kaun sa seeds acha hai?,advice
is mandi up for cotton aaj?,market
govt pm kisan for sarso,subsidy
tell me gehun mkt,market
riseka markit kya hai todday?,market
markit markit for potato??,market
will it dhoop kal,weather
is markit up for rice now,market
pyaz is dying what to do,disease
NEEDSARKAR FOR FARMING,subsidy
how to apply for loan,subsidy
disease attack on wheet,disease
LOAN FORM KAHA MILEGA,subsidy
kisan credit card loan,subsidy
toomuch dhoop for tamatar,weather
barishforecast for punjab,weather
shouldi give plant to tomato todday?,advice
is rate up for sugarcane now?,market
weather tmrw,weather
howto apply for pm kisan,subsidy
wedder alert needed,weather
wedder forecast for punjab,weather
ANY CHANCE OF WEATHER KAL,weather
right time for aloo pani,advice
WHEN TO PANI PYAZ?,advice
medicine for sarso sukha,disease
when to fertilizer wheat?,advice
how is the wether now?,weather
sell wheet now mkt,market
HOW MUCH SEEDS FOR TOMATO?,advice
cotton pryce,market
intercroppingwith tamatar,advice
ismosam coming?,weather
medicine for soybean spots,disease
how much pani for kanak?,advice
prycepryce for ganna??,market
pyaz ka bhav kya hai now?,market
HOW IS THE TEMP TODAY,weather
will it temp 2moro?,weather
govtstatus,subsidy
wheet me sukha lag gaya,disease
need pm kisan for farming,subsidy
govt sarkar for dhan,subsidy
is there any pm kisan for pyaz farmers?,subsidy
how is the mosam td?,weather
gehun ke liye kaun sa beej acha hai,advice
how much seeds for onion?,advice
sell cotton aaj mkt,market
kya next day heat hogi?,weather
wether tmrw,weather
sabsidi form kaha milega,subsidy
right time for ganna khad,advice
is mausam coming?,weather
right time for pyaz urea,advice
when to dap corn?,advice
spotson tamatar jad,disease
sellwheat now market,market
whatfertilizer for rise?,advice
how to save kapas from bimari,disease
bank status,subsidy
current soyabean price price,market
kyatomorrow weather hogi?,weather
kya tomorrow barish hogi?,weather
white powder on kapas,disease
sick gehun help,disease
kapasret,market
schem for tractor,subsidy
current corn paise paise,market
PMsubsidy details,subsidy
dhoop forecast for punjab,weather
WHENTO UREA MUSTARD,advice
dying attack on tamatar,disease
ANY CHANCE OF BARISH TOMORROW,weather
needyojana for farming,subsidy
mandi mandi for potato??,market
when to ugana wheat?,advice
dhoopnext day,weather
what is the paise of wheat aaj?,market
currentwheat baav baav,market
chawal ret,market
gehu me pest lag gaya,disease
medicine for potato pest,disease
too much rain for pyaz,weather
any chance of baarish kal?,weather
need bank for farming,subsidy
mykanak crop are turning yellow,disease
need subsidy for farming,subsidy
potato ka markit kya hai aaj?,market
sellwheet now mkt,market
is markit up for potato now?,market
yojana status,subsidy
current sugarcane price price,market
current aloo rate rate,market
govt karz for chawal,subsidy
is there any sabsidi for potato farmers?,subsidy
potatoka ret kya hai 2day?,market
need help with wheet fertilizer,advice
medicine for mustard dying,disease
SHOULD I GIVE KHAD TO GANNA TD?,advice
pm kisan status,subsidy
temp alert needed,weather
kya tmrw dhoop hogi,weather
rain tmrw,weather
intercroppingwith wheet,advice
sarkarfor tractor,subsidy
WHAT IS THE BHAV OF WHEET AAJ,market
KYA TMRW WETHER HOGI?,weather
potato ka mandi kya hai now,market
how to apply for bank,subsidy
chawalka baav kya hai aaj,market
pest attack on mustard,disease
sabsidiform kaha milega,subsidy
medicine for ganna yellowing,disease
need help with mustard dap,advice
what urea for pyaz?,advice
currentrise baav baav,market
best grow for soyabean,advice
TAMATAR KE LIYE KAUN SA FERTILIZER ACHA HAI?,advice
white powder on gehun,disease
currentwheet mkt mkt,market
white powder on kanak,disease
my gehu jad are turning yellow,disease
white powder on pyaz,disease
BANK FOR TRACTOR,subsidy
spotson tamatar stem,disease
mosam forecast for punjab,weather
intercropping with cotton,advice
dhan me spots lag gaya,disease
should i give grow to tomato td,advice
RAIN ALERT NEEDED,weather
BUGS ATTACK ON GANNA,disease
need help with pyaz beej,advice
CHAWALME YELLOWING LAG GAYA,disease
spots on potato leaves,disease
need help with rise beej,advice
bestgrow for tomato,advice
kisancredit card pm kisan,subsidy
wedder forecast for punjab,weather
chawal ke liye kaun sa boi acha hai?,advice
when to dap pyaz?,advice
where to sell wheat for good rate,market
soyabean ka ret kya hai aaj,market
sarsome sukha lag gaya,disease
schem form kaha milega,subsidy
where to sell tomato for good markit,market
isthere any bank for sugarcane farmers,subsidy
how to apply for subsidy,subsidy
too much weather for cotton,weather
schem status,subsidy
sarkar for tractor,subsidy
TELL ME COTTON RATE,market
wedderforecast for punjab,weather
sukha kanak help,disease
is there any sarkar for tamatar farmers,subsidy
govt status,subsidy
kisan credit card scheme,subsidy
PMgovt details,subsidy
medicinefor cotton disease,disease
gehume sukha lag gaya,disease
kya tomorrow baarish hogi?,weather
makka ka pryce kya hai aaj?,market
schem form kaha milega,subsidy
spots on ganna crop,disease
govt sarkar for sarso,subsidy
gehun ka prise kya hai now?,market
best khad for aloo,advice
kisancredit card sabsidi,subsidy
any chance of wedder tomorrow,weather
sarkar status,subsidy
currentonion mandi mandi,market
PM bank details,subsidy
what is the mkt of ganna todday?,market
bugs in aloo,disease
kisan credit card subsidy,subsidy
how is the wedder now?,weather
whereto sell makka for good bhav,market
white powder on corn,disease
willit barish tomorow?,weather
how to apply for subsidy,subsidy
howto apply for scheme,subsidy
IS THERE ANY SABSIDI FOR POTATO FARMERS?,subsidy
toomuch heat for kapas,weather
need karz for farming,subsidy
tell me soybean mkt,market
where to sell tomato for good pryce,market
soybean mandi,market
sabsidi status,subsidy
mausamforecast for punjab,weather
IS BARISH COMING?,weather
tellme soyabean paise,market
IS THERE ANY SCHEM FOR POTATO FARMERS?,subsidy
best beej for cotton,advice
kya tmrw dhoop hogi?,weather
howto save gehu from bugs,disease
temp 2moro,weather
right time for rice khad,advice
intercropping with chawal,advice
potato ka paise kya hai td?,market
schem status,subsidy
tellme tamatar price,market
WILL IT WETHER TMRW?,weather
too much rain for cotton,weather
intercropping with gehu,advice
any chance of wedder 2moro,weather
any chance of mosam tmrw,weather
bugs in makka,disease
need bank for farming,subsidy
kapasme spots lag gaya,disease
MY KAPAS TANA ARE TURNING YELLOW,disease
kisancredit card yojana,subsidy
how to apply for karz,subsidy
is there any sabsidi for pyaz farmers,subsidy
SPOTS ON DHAN TANA,disease
spots on mustard stem,disease
markit markit for sarso??,market
bimari kapas help,disease
kanak prise,market
sell wheet today markit,market
PRYCE PRYCE FOR RICE??,market
howto apply for pm kisan,subsidy
spots on soybean leaves,disease
what is the markit of wheet aaj?,market
schem status,subsidy
onionis dying what to do,disease
sell rise aaj baav,market
kisan credit card sabsidi,subsidy
soyabean me bimari lag gaya,disease
