text,intent
is there any bank for kapas farmers?,subsidy
whatis the mkt of rice todday?,market
should i give pani to corn td?,advice
karzstatus,subsidy
weather alert needed,weather
PM yojana details,subsidy
mausam forecast for punjab,weather
ret ret for gehun,market
paise paise for aloo??,market
sell makka aaj paise,market
WHITE POWDER ON TAMATAR,disease
too much mausam for kanak,weather
weatherforecast for punjab,weather
any chance of mausam next day,weather
WHAT DAP FOR SARSO?,advice
how much plant for corn?,advice
howto save sarso from bugs,disease
is dhoop coming?,weather
kya 2moro wedder hogi?,weather
KISAN CREDIT CARD PM KISAN,subsidy
soybean mkt,market
price price for gehun??,market
corn ka mandi kya hai todday?,market
dhoop forecast for punjab,weather
my tomato crop are turning yellow,disease
medicine for gehun dying,disease
kisan credit card yojana,subsidy
tomato ke liye kaun sa dap acha hai,advice
medicine for wheet bimari,disease
any chance of barish tomorrow?,weather
right time for soybean boi,advice
govt status,subsidy
medicine for potato keeda,disease
schem form kaha milega,subsidy
how to save onion from bimari,disease
what is the price of wheet today?,market
white powder on ganna,disease
where to sell gehun for good market,market
my pyaz tana are turning yellow,disease
bimari aloo help,disease
INTERCROPPING WITH WHEAT,advice
TEMPALERT NEEDED,weather
what plant for aloo?,advice
how much beej for tomato?,advice
govt govt for sugarcane,subsidy
wether next day,weather
intercropping with kanak,advice
should i give seeds to tomato now?,advice
when to boi wheet?,advice
onion ke liye kaun sa fertilizer acha hai?,advice
best urea for onion,advice
too much wether for onion,weather
how much khad for chawal?,advice
tell me gehun ret,market
isbaarish coming,weather
bimari makka help,disease
how to save gehun from pest,disease
how is the mausam todday?,weather
current rice prise prise,market
my rice root are turning yellow,disease
is markit up for cotton td,market
kisan credit card karz,subsidy
should i give ugana to gehu aaj?,advice
onionka baav kya hai td?,market
current rice markit markit,market
ismarkit up for mustard now?,market
bugs in gehu,disease
how is the baarish aaj?,weather
PM schem details,subsidy
is there any scheme for mustard farmers?,subsidy
where to sell rice for good pryce,market
isbaav up for kapas todday,market
white powder on soyabean,disease
subsidy status,subsidy
sarkar status,subsidy
wheatka mandi kya hai td?,market
medicine for soybean bimari,disease
SUBSIDY FORM KAHA MILEGA,subsidy
where to sell rise for good baav,market
needkarz for farming,subsidy
medicine for mustard yellowing,disease
MEDICINE FOR CORN PEST,disease
wether kal,weather
how much grow for chawal?,advice
mosam alert needed,weather
kisancredit card pm kisan,subsidy
is markit up for makka now?,market
schemform kaha milega,subsidy
need sarkar for farming,subsidy
SUKHA GANNA HELP,disease
is market up for dhan aaj?,market
kya tmrw mosam hogi?,weather
HOW IS THE WEATHER TODAY?,weather
ANY CHANCE OF WEDDER TOMORROW,weather
too much wedder for soyabean,weather
govt govt for mustard,subsidy
cotton ke liye kaun sa beej acha hai?,advice
current kanak prise prise,market
price price for sugarcane??,market
need help with dhan ugana,advice
where to sell pyaz for good mkt,market
govt subsidy for cotton,subsidy
sell soyabean todday bhav,market
when to ugana rise?,advice
how much plant for aloo,advice
mandi mandi for kanak??,market
is there any karz for ganna farmers?,subsidy
is ret up for mustard aaj,market
need help with rise boi,advice
when to ugana kanak?,advice
potato prise,market
what boi for tomato,advice
whereto sell wheat for good prise,market
how is the mosam 2day?,weather
rate rate for chawal??,market
gehu ke liye kaun sa plant acha hai?,advice
my kanak tana are turning yellow,disease
yojana form kaha milega,subsidy
right time for dhan water,advice
how to save wheet from sick,disease
govt sabsidi for sugarcane,subsidy
will it dhoop tomorow?,weather
white powder on aloo,disease
is there any sabsidi for kanak farmers?,subsidy
my cotton fasal are turning yellow,disease
loan status,subsidy
soyabean ka ret kya hai 2day?,market
corn me dry lag gaya,disease
current kapas mandi mandi,market
tell me soyabean mandi,market
rain forecast for punjab,weather
medicine for rice spots,disease
govt govt for kanak,subsidy
tell me chawal markit,market
whatwater for rice?,advice
pyazbhav,market
how much fertilizer for cotton?,advice
pyaz pryce,market
what fertilizer for pyaz,advice
too much temp for aloo,weather
is there any subsidy for wheet farmers?,subsidy
spots on pyaz pattiyan,disease
right time for onion seeds,advice
isthere any sarkar for soyabean farmers,subsidy
temp forecast for punjab,weather
markit markit for rice??,market
mosam forecast for punjab,weather
when to plant pyaz?,advice
subsidy form kaha milega,subsidy
wether 2moro,weather
kya next day mausam hogi?,weather
bugs attack on kanak,disease
is temp coming,weather
PM sabsidi details,subsidy
what is the bhav of dhan td?,market
is there any subsidy for ganna farmers?,subsidy
SELLMAKKA AAJ PAISE,market
best urea for potato,advice
mausam tomorow,weather
MAUSAM FORECAST FOR PUNJAB,weather
spots on makka crop,disease
dhoop tmrw,weather
how much water for kanak?,advice
medicine for soyabean disease,disease
CURRENT GEHUN PRISE PRISE,market
how much khad for soybean?,advice
intercropping with wheet,advice
bugsin wheet,disease
how to save cotton from dry,disease
my soybean root are turning yellow,disease
my corn root are turning yellow,disease
aloo is dying what to do,disease
govt schem for rice,subsidy
dhan me disease lag gaya,disease
mausam forecast for punjab,weather
right time for gehu beej,advice
mosamforecast for punjab,weather
sick attack on tomato,disease
barish 2moro,weather
need help with onion fertilizer,advice
how to save soybean from keeda,disease
HOW TO APPLY FOR SCHEME,subsidy
my kapas jad are turning yellow,disease
too much mosam for sarso,weather
markit markit for soybean??,market
bugs in soyabean,disease
kisan credit card govt,subsidy
how to apply for sabsidi,subsidy
where to sell cotton for good mkt,market
any chance of weather tmrw,weather
dhoopforecast for punjab,weather
how to save ganna from dying,disease
yojana form kaha milega,subsidy
current soybean bhav bhav,market
ganna me pest lag gaya,disease
tellme kapas ret,market
how is the weather aaj?,weather
govt schem for kanak,subsidy
weather tmrw,weather
whereto sell chawal for good markit,market
wether alert needed,weather
kanak me keeda lag gaya,disease
kisan credit card schem,subsidy
when to plant soyabean?,advice
currentmakka paise paise,market
SUGARCANEIS DYING WHAT TO DO,disease
is wedder coming?,weather
sabsidi for tractor,subsidy
white powder on onion,disease
PM loan details,subsidy
kya next day weather hogi,weather
tell me soybean pryce,market
tamatar baav,market
what is the market of sarso 2day?,market
when to dap chawal?,advice
will it mosam 2moro,weather
dying tamatar help,disease
IS RET UP FOR GEHUN TD?,market
baavbaav for rice??,market
yojana for tractor,subsidy
how much pani for aloo,advice
spots on soyabean root,disease
govtscheme for rice,subsidy
HOWIS THE MOSAM TODAY,weather
baarish 2moro,weather
spotson gehun jad,disease
how to apply for pm kisan,subsidy
tempforecast for punjab,weather
bugs in gehu,disease
intercropping with chawal,advice
kya kal temp hogi,weather
when to pani pyaz?,advice
my rice leaves are turning yellow,disease
wether forecast for punjab,weather
should i give khad to sarso today?,advice
subsidy for tractor,subsidy
is there any karz for potato farmers?,subsidy
bestfertilizer for ganna,advice
bugs in kanak,disease
pestrise help,disease
pyaz me spots lag gaya,disease
subsidy for tractor,subsidy
how much seeds for chawal,advice
howto apply for yojana,subsidy
gehu is dying what to do,disease
kisan credit card loan,subsidy
spots on cotton pattiyan,disease
PM govt details,subsidy
kya tmrw wether hogi?,weather
when to urea sarso,advice
need help with cotton beej,advice
what is the prise of ganna aaj,market
should i give fertilizer to chawal td,advice
RIGHTTIME FOR KAPAS DAP,advice
temp tomorrow,weather
GOVTSUBSIDY FOR GEHUN,subsidy
SARKAR FOR TRACTOR,subsidy
tell me tomato pryce,market
need yojana for farming,subsidy
CURRENT TAMATAR MANDI MANDI,market
TOMATO KA MARKIT KYA HAI TODAY?,market
RIGHT TIME FOR SARSO PANI,advice
NEED HELP WITH DHAN DAP,advice
tamatar ka bhav kya hai 2day,market
is there any govt for gehun farmers?,subsidy
SELL KAPAS NOW PAISE,market
ANY CHANCE OF WETHER TMRW?,weather
govt for tractor,subsidy
PM govt details,subsidy
bugsattack on pyaz,disease
dhanke liye kaun sa ugana acha hai?,advice
any chance of wether kal,weather
should i give water to soybean todday?,advice
how to save chawal from sick,disease
baarish tomorow,weather
is there any bank for makka farmers?,subsidy
where to sell kanak for good market,market
white powder on onion,disease
tellme wheat mandi,market
tamatar is dying what to do,disease
spots on wheet pattiyan,disease
how to save cotton from spots,disease
whereto sell ganna for good market,market
is ret up for soybean today?,market
too much barish for cotton,weather
dry aloo help,disease
is baarish coming,weather
bugs in mustard,disease
kya next day dhoop hogi,weather
scheme status,subsidy
howmuch plant for chawal?,advice
is there any loan for onion farmers,subsidy
how to apply for schem,subsidy
iswedder coming?,weather
keeda mustard help,disease
onion ke liye kaun sa grow acha hai?,advice
kapas ka pryce kya hai aaj?,market
howto save cotton from pest,disease
govt bank for dhan,subsidy
willit mausam 2moro?,weather
bugs in ganna,disease
kisan credit card schem,subsidy
anychance of mausam kal?,weather
what urea for chawal?,advice
PM schem details,subsidy
spots on soybean pattiyan,disease
mausam kal,weather
shouldi give pani to soyabean td?,advice
how to apply for bank,subsidy
any chance of mosam next day,weather
willit baarish 2moro?,weather
intercropping with kapas,advice
white powder on gehu,disease
any chance of barish tomorow,weather
bugs in tomato,disease
corn me keeda lag gaya,disease
my wheat fasal are turning yellow,disease
sellsoyabean now pryce,market
pmkisan for tractor,subsidy
kya tomorow mosam hogi?,weather
kisan credit card bank,subsidy
too much rain for rise,weather
subsidy for tractor,subsidy
is there any scheme for pyaz farmers?,subsidy
whitepowder on onion,disease
too much mausam for aloo,weather
whatis the rate of kanak 2day?,market
ISPRICE UP FOR RICE AAJ?,market
intercropping with sugarcane,advice
spots on tamatar leaves,disease
where to sell rise for good bhav,market
what is the markit of gehu aaj,market
bugsin chawal,disease
SHOULD I GIVE SEEDS TO GEHUN TODDAY?,advice
sarkar status,subsidy
need help with soyabean boi,advice
will it barish tmrw?,weather
weather forecast for punjab,weather
current corn markit markit,market
need yojana for farming,subsidy
intercropping with onion,advice
medicine for wheet yellowing,disease
mausam 2moro,weather
intercropping with mustard,advice
is there any schem for rice farmers?,subsidy
my onion crop are turning yellow,disease
how to save sarso from dying,disease
bank status,subsidy
tell me dhan pryce,market
tellme makka market,market
loan form kaha milega,subsidy
when to beej wheat?,advice
will it wedder tmrw,weather
is there any karz for sugarcane farmers?,subsidy
how to save kanak from dry,disease
cotton ke liye kaun sa grow acha hai?,advice
intercropping with onion,advice
is baarish coming?,weather
intercroppingwith kapas,advice
kanak ke liye kaun sa beej acha hai?,advice
dhoop alert needed,weather
dry sugarcane help,disease
bhav bhav for corn??,market
how to save gehu from disease,disease
HOWTO APPLY FOR PM KISAN,subsidy
need help with pyaz khad,advice
best khad for wheet,advice
too much barish for gehu,weather
sell kanak now pryce,market
NEED HELP WITH SARSO FERTILIZER,advice
PM loan details,subsidy
current cotton markit markit,market
PMgovt details,subsidy
MEDICINE FOR MAKKA SPOTS,disease
medicine for rice spots,disease
sugarcane me disease lag gaya,disease
what water for rice?,advice
is bhav up for tamatar now?,market
bugs in chawal,disease
loanfor tractor,subsidy
white powder on soyabean,disease
potato me keeda lag gaya,disease
need govt for farming,subsidy
too much heat for sugarcane,weather
howmuch urea for cotton,advice
rise me keeda lag gaya,disease
currentrice price price,market
when to pani rice?,advice
right time for makka grow,advice
intercroppingwith sugarcane,advice
what khad for corn,advice
BUGS ATTACK ON RICE,disease
bankform kaha milega,subsidy
how to save wheat from sukha,disease
how much water for kapas?,advice
will it wether tmrw?,weather
schem form kaha milega,subsidy
best seeds for aloo,advice
CORN KE LIYE KAUN SA DAP ACHA HAI?,advice
BUGSIN COTTON,disease
WHITE POWDER ON TAMATAR,disease
gehunret,market
sell gehun td rate,market
is rate up for ganna aaj?,market
where to sell pyaz for good ret,market
intercropping with corn,advice
need help with corn plant,advice
how to apply for sarkar,subsidy
gehun ret,market
govt pm kisan for aloo,subsidy
ret ret for mustard??,market
ispryce up for onion aaj,market
bugs in potato,disease
kya tomorrow mausam hogi,weather
market market for tamatar??,market
shouldi give plant to wheat aaj?,advice
kisan credit card subsidy,subsidy
right time for kanak grow,advice
PMschem details,subsidy
too much baarish for aloo,weather
will it wether tmrw?,weather
current rice bhav bhav,market
is there any sabsidi for dhan farmers,subsidy
current mustard mandi mandi,market
white powder on soyabean,disease
spots on wheat crop,disease
will it mosam 2moro,weather
will it heat kal?,weather
corn ka pryce kya hai todday?,market
wheet me bimari lag gaya,disease
tamatar ke liye kaun sa ugana acha hai?,advice
any chance of heat kal?,weather
sick aloo help,disease
is mandi up for kanak now,market
wether tomorow,weather
SUKHA ATTACK ON CHAWAL,disease
sellaloo todday paise,market
wheet me dying lag gaya,disease
my rice fasal are turning yellow,disease
KARZ FORM KAHA MILEGA,subsidy
kyanext day baarish hogi?,weather
wedderalert needed,weather
how to apply for bank,subsidy
mkt mkt for ganna,market
medicine for aloo pest,disease
soyabean is dying what to do,disease
when to water rise?,advice
whento grow sarso?,advice
current tamatar bhav bhav,market
is there any yojana for makka farmers?,subsidy
will it wedder tmrw?,weather
spots on rice stem,disease
is mosam coming?,weather
bugs chawal help,disease
govtfor tractor,subsidy
mosam forecast for punjab,weather
should i give fertilizer to potato today?,advice
spotson aloo pattiyan,disease
will it rain tomorrow,weather
HOW MUCH FERTILIZER FOR CORN?,advice
currenttomato pryce pryce,market
best pani for aloo,advice
GEHUN IS DYING WHAT TO DO,disease
kisan credit card govt,subsidy
govt loan for mustard,subsidy
pyaz me sick lag gaya,disease
where to sell gehu for good rate,market
tell me mustard market,market
what ugana for sugarcane,advice
WHEN TO GROW KANAK,advice
onionme bimari lag gaya,disease
tell me makka ret,market
tell me ganna market,market
kisan credit card pm kisan,subsidy
sarkar form kaha milega,subsidy
isthere any pm kisan for rice farmers,subsidy
pyaz me bugs lag gaya,disease
where to sell sugarcane for good prise,market
IS MKT UP FOR MAKKA NOW?,market
PM SCHEM DETAILS,subsidy
sell sarso todday paise,market
GOVT FORM KAHA MILEGA,subsidy
current ganna paise paise,market
best khad for onion,advice
YOJANA FOR TRACTOR,subsidy
should i give fertilizer to potato today?,advice
kya tomorrow heat hogi,weather
current aloo paise paise,market
what is the markit of wheat aaj,market
KISAN CREDIT CARD LOAN,subsidy
kisan credit card bank,subsidy
right time for wheat beej,advice
tellme gehun bhav,market
what water for soyabean?,advice
dying attack on gehu,disease
mysugarcane crop are turning yellow,disease
kisan credit card schem,subsidy
dhoop 2moro,weather
govt sarkar for ganna,subsidy
bugs corn help,disease
bugs in dhan,disease
bimari makka help,disease
any chance of baarish tmrw?,weather
PM bank details,subsidy
is weather coming,weather
need help with rice plant,advice
kisan credit card subsidy,subsidy
bestbeej for soybean,advice
tell me dhan baav,market
intercropping with corn,advice
mausam alert needed,weather
right time for cotton grow,advice
need help with wheet boi,advice
govt sabsidi for makka,subsidy
how is the weather aaj?,weather
loan status,subsidy
cotton ka baav kya hai aaj,market
current gehu baav baav,market
WHAT BEEJ FOR KAPAS?,advice
white powder on makka,disease
shouldi give ugana to tomato td,advice
need help with kanak dap,advice
best dap for kapas,advice
kisan credit card sabsidi,subsidy
wedder next day,weather
WEATHER FORECAST FOR PUNJAB,weather
my wheat jad are turning yellow,disease
will it dhoop tomorrow?,weather
is there any sarkar for rise farmers?,subsidy
is there any schem for tamatar farmers,subsidy
spots on cotton fasal,disease
need sabsidi for farming,subsidy
white powder on aloo,disease
currentcorn market market,market
PMgovt details,subsidy
makkamarkit,market
what is the market of soybean todday?,market
whereto sell rice for good price,market
govt schem for corn,subsidy
my kapas leaves are turning yellow,disease
KYATOMOROW WEATHER HOGI?,weather
baarish tmrw,weather
need help with rise boi,advice
kya tomorow wether hogi?,weather
bugs in corn,disease
medicine for gehu sukha,disease
need subsidy for farming,subsidy
kisan credit card karz,subsidy
kya 2moro heat hogi,weather
chawal ka ret kya hai today?,market
white powder on ganna,disease
sabsidi status,subsidy
mytamatar pattiyan are turning yellow,disease
bank for tractor,subsidy
whatis the pryce of wheet aaj?,market
potato me pest lag gaya,disease
medicinefor onion sukha,disease
tell me tamatar prise,market
ismarkit up for pyaz today,market
tamatar is dying what to do,disease
white powder on sarso,disease
kya 2moro weather hogi?,weather
how is the temp aaj,weather
INTERCROPPINGWITH TOMATO,advice
yojana form kaha milega,subsidy
INTERCROPPING WITH ONION,advice
too much weather for sugarcane,weather
is wether coming,weather
ismarkit up for onion todday?,market
HOW TO SAVE MUSTARD FROM YELLOWING,disease
need help with dhan water,advice
righttime for potato grow,advice
RIGHT TIME FOR GEHUN UGANA,advice
rain forecast for punjab,weather
pryce pryce for rise??,market
shouldi give dap to aloo td?,advice
bankfor tractor,subsidy
sick attack on soyabean,disease
should i give urea to soybean 2day,advice
mausamnext day,weather
kyakal heat hogi?,weather
rise me dry lag gaya,disease
barish forecast for punjab,weather
sell cotton todday paise,market
should i give seeds to wheat now,advice
medicine for tomato pest,disease
right time for wheet water,advice
gehun ka prise kya hai todday?,market
sarkar form kaha milega,subsidy
wedder alert needed,weather
govt scheme for mustard,subsidy
how much fertilizer for potato?,advice
kya tmrw wedder hogi?,weather
tamatar ke liye kaun sa seeds acha hai,advice
dying attack on tomato,disease
is there any sarkar for aloo farmers,subsidy
kya next day heat hogi?,weather
when to boi chawal?,advice
medicine for rice sukha,disease
scheme form kaha milega,subsidy
ismandi up for mustard todday?,market
white powder on potato,disease
when to grow sarso?,advice
soybean ke liye kaun sa dap acha hai?,advice
makka ke liye kaun sa seeds acha hai,advice
istemp coming?,weather
rice is dying what to do,disease
rise ka bhav kya hai today?,market
baarish alert needed,weather
spots on tamatar fasal,disease
right time for rice boi,advice
mycorn pattiyan are turning yellow,disease
PRICE PRICE FOR MUSTARD??,market
govtsabsidi for tomato,subsidy
how much dap for rise?,advice
PM PM KISAN DETAILS,subsidy
sabsidi form kaha milega,subsidy
mustard price,market
currentsugarcane ret ret,market
sarkar for tractor,subsidy
spots on makka tana,disease
soybean ke liye kaun sa boi acha hai?,advice
kisancredit card karz,subsidy
white powder on sarso,disease
what is the paise of aloo today,market
medicine for rice dry,disease
spotson gehun pattiyan,disease
sarkar for tractor,subsidy
corn ke liye kaun sa ugana acha hai?,advice
howto apply for bank,subsidy
should i give water to soybean aaj,advice
govt status,subsidy
kisan credit card schem,subsidy
how to apply for subsidy,subsidy
how to save mustard from sick,disease
too much mausam for mustard,weather
PM subsidy details,subsidy
iswedder coming?,weather
what is the bhav of cotton aaj,market
potatorate,market
medicine for sugarcane keeda,disease
how is the mausam td?,weather
howto apply for bank,subsidy
DISEASE MUSTARD HELP,disease
onionis dying what to do,disease
kisancredit card schem,subsidy
howmuch ugana for rise?,advice
sabsidi status,subsidy
how to apply for schem,subsidy
heat forecast for punjab,weather
sukha attack on potato,disease
kisan credit card sabsidi,subsidy
israte up for cotton now?,market
weather forecast for punjab,weather
kapas ke liye kaun sa grow acha hai?,advice
current kanak mkt mkt,market
CURRENT KAPAS MKT MKT,market
whento ugana kapas?,advice
sell tomato now mandi,market
tell me tomato pryce,market
barishalert needed,weather
PM schem details,subsidy
govt for tractor,subsidy
right time for wheat pani,advice
kisan credit card govt,subsidy
should i give khad to dhan td?,advice
how to apply for yojana,subsidy
how much dap for kapas,advice
howto save pyaz from yellowing,disease
yellowingsoyabean help,disease
gehu ka ret kya hai now,market
dry attack on pyaz,disease
will it wedder kal?,weather
MARKETMARKET FOR SOYABEAN??,market
white powder on aloo,disease
corn me keeda lag gaya,disease
CORN ME BIMARI LAG GAYA,disease
current chawal bhav bhav,market
white powder on kapas,disease
needscheme for farming,subsidy
any chance of rain tomorow?,weather
white powder on tomato,disease
medicine for cotton dry,disease
what grow for tomato?,advice
my soybean jad are turning yellow,disease
sabsidi status,subsidy
white powder on rise,disease
potato ka mandi kya hai todday?,market
weather forecast for punjab,weather
medicine for pyaz dying,disease
kisan credit card sarkar,subsidy
my tamatar tana are turning yellow,disease
is there any yojana for wheat farmers?,subsidy
loan form kaha milega,subsidy
any chance of wedder tomorow?,weather
current potato pryce pryce,market
yellowing attack on wheet,disease
right time for sugarcane seeds,advice
market market for cotton,market
sell soyabean 2day rate,market
what dap for onion?,advice
soybean is dying what to do,disease
KISANCREDIT CARD YOJANA,subsidy
PM pm kisan details,subsidy
how to save kapas from spots,disease
cotton ka prise kya hai 2day?,market
yojana form kaha milega,subsidy
how much seeds for pyaz?,advice
schem form kaha milega,subsidy
how much pani for gehu?,advice
IS RET UP FOR SOYBEAN TD,market
any chance of barish tomorrow,weather
need help with tamatar dap,advice
how to apply for loan,subsidy
white powder on kanak,disease
temp kal,weather
pm kisan status,subsidy
what is the bhav of mustard today,market
INTERCROPPING WITH TOMATO,advice
tell me dhan pryce,market
intercropping with sarso,advice
isweather coming,weather
SARSOKE LIYE KAUN SA PANI ACHA HAI?,advice
how much water for ganna,advice
tell me wheet mkt,market
will it mausam next day?,weather
WHAT IS THE RET OF KANAK TODDAY?,market
wedder alert needed,weather
SOYABEAN KA MANDI KYA HAI 2DAY?,market
markitmarkit for mustard,market
how much boi for aloo?,advice
will it wedder tmrw?,weather
current wheet ret ret,market
mosam forecast for punjab,weather
kya kal wedder hogi?,weather
what ugana for chawal?,advice
howmuch grow for chawal,advice
where to sell ganna for good market,market
sell rice 2day ret,market
sick kapas help,disease
too much barish for mustard,weather
sugarcane bhav,market
SHOULD I GIVE GROW TO GEHUN TODAY,advice
mkt mkt for pyaz??,market
my gehu crop are turning yellow,disease
SHOULD I GIVE DAP TO SUGARCANE TD?,advice
CURRENT DHAN PRISE PRISE,market
medicine for rise dying,disease
current pyaz mandi mandi,market
is pryce up for soyabean todday?,market
cottonka mkt kya hai aaj?,market
subsidy for tractor,subsidy
tempalert needed,weather
MOSAMTOMOROW,weather
tell me gehu paise,market
intercropping with tomato,advice
gehun me yellowing lag gaya,disease
need help with aloo urea,advice
pm kisan status,subsidy
baarish alert needed,weather
whatis the prise of wheet today?,market
need subsidy for farming,subsidy
need sarkar for farming,subsidy
soyabean is dying what to do,disease
CURRENT POTATO BAAV BAAV,market
my mustard jad are turning yellow,disease
ganna ka pryce kya hai now?,market
whatpani for cotton?,advice
kya 2moro mausam hogi?,weather
is pryce up for pyaz today,market
sellkanak today rate,market
what beej for corn?,advice
sukha sugarcane help,disease
GOVT SARKAR FOR ALOO,subsidy
yojana for tractor,subsidy
RET RET FOR SUGARCANE??,market
dhanke liye kaun sa fertilizer acha hai?,advice
bugs in tomato,disease
ret ret for kapas??,market
whatis the price of kapas 2day?,market
any chance of rain tmrw?,weather
weatherforecast for punjab,weather
ret ret for wheet??,market
WEATHER FORECAST FOR PUNJAB,weather
how is the dhoop aaj?,weather
karz status,subsidy
tell me rice mkt,market
intercropping with sugarcane,advice
whitepowder on tamatar,disease
howto apply for sarkar,subsidy
NEED HELP WITH POTATO PLANT,advice
sick attack on soyabean,disease
bugs in chawal,disease
medicine for tamatar spots,disease
KANAK IS DYING WHAT TO DO,disease
need schem for farming,subsidy
sugarcane ke liye kaun sa ugana acha hai,advice
schemeform kaha milega,subsidy
paise paise for cotton??,market
what is the price of dhan todday?,market
shouldi give ugana to aloo td?,advice
need govt for farming,subsidy
bank form kaha milega,subsidy
karz status,subsidy
pyaz ka prise kya hai now?,market
kya kal wether hogi?,weather
intercropping with ganna,advice
spots makka help,disease
spotson tamatar stem,disease
WILL IT HEAT TOMORROW?,weather
CORN IS DYING WHAT TO DO,disease
will it baarish tomorrow?,weather
