text,intent
weather tmrw,weather
is temp coming,weather
wheat prise,market
karz status,subsidy
spotson wheet leaves,disease
anychance of mausam next day?,weather
wheet ke liye kaun sa urea acha hai?,advice
temp alert needed,weather
howmuch urea for pyaz?,advice
current wheet rate rate,market
kisan credit card sarkar,subsidy
howis the wether today?,weather
mosam 2moro,weather
bestbeej for corn,advice
makka me spots lag gaya,disease
bankform kaha milega,subsidy
kanakis dying what to do,disease
how to save soyabean from sukha,disease
white powder on onion,disease
govt schem for gehu,subsidy
NEED SCHEM FOR FARMING,subsidy
my potato pattiyan are turning yellow,disease
medicine for wheat keeda,disease
toomuch temp for pyaz,weather
mkt mkt for rice??,market
too much temp for makka,weather
should i give plant to tamatar now?,advice
where to sell wheet for good ret,market
need help with tomato seeds,advice
kisan credit card subsidy,subsidy
sell potato todday bhav,market
PMsarkar details,subsidy
what plant for potato,advice
current onion bhav bhav,market
white powder on ganna,disease
how to apply for sarkar,subsidy
is wether coming?,weather
whatis the pryce of rice today,market
intercropping with sarso,advice
need scheme for farming,subsidy
is rain coming,weather
my potato stem are turning yellow,disease
bugs in chawal,disease
current soybean ret ret,market
how to save ganna from pest,disease
what seeds for rise?,advice
need bank for farming,subsidy
need help with gehu seeds,advice
yellowingattack on wheet,disease
spots on sugarcane pattiyan,disease
rain alert needed,weather
temp tmrw,weather
isweather coming?,weather
isdhoop coming?,weather
tell me sarso price,market
what is the rate of cotton todday,market
bank for tractor,subsidy
bugs in soyabean,disease
PM subsidy details,subsidy
mausam alert needed,weather
how to apply for sarkar,subsidy
kisancredit card sarkar,subsidy
sell makka now markit,market
spotsattack on dhan,disease
is baav up for pyaz aaj,market
bugs soybean help,disease
rain forecast for punjab,weather
should i give water to rice now,advice
karz status,subsidy
soybean ret,market
need help with makka khad,advice
sell sugarcane 2day mandi,market
white powder on makka,disease
needsarkar for farming,subsidy
govt karz for pyaz,subsidy
subsidystatus,subsidy
wether2moro,weather
govt yojana for gehu,subsidy
medicine for sugarcane keeda,disease
tamatar pryce,market
toomuch barish for tamatar,weather
kya tomorow weather hogi?,weather
BIMARI GEHUN HELP,disease
how to save kapas from dry,disease
yojana form kaha milega,subsidy
bugs in onion,disease
mosam tomorow,weather
yojanastatus,subsidy
kisancredit card pm kisan,subsidy
how to apply for scheme,subsidy
spotson rice root,disease
soyabean me bugs lag gaya,disease
weather tomorrow,weather
what is the price of onion today?,market
gehu ke liye kaun sa dap acha hai?,advice
best beej for ganna,advice
right time for rice khad,advice
how is the rain today?,weather
any chance of mausam next day?,weather
yojana status,subsidy
shouldi give boi to mustard now,advice
kyatmrw mausam hogi?,weather
pest attack on pyaz,disease
white powder on rise,disease
too much baarish for wheat,weather
wheet ke liye kaun sa grow acha hai?,advice
TOMATO PRYCE,market
kyakal weather hogi?,weather
wethertomorrow,weather
white powder on corn,disease
sarso ka ret kya hai aaj,market
intercropping with sarso,advice
white powder on wheat,disease
white powder on ganna,disease
kya tomorow rain hogi?,weather
whereto sell ganna for good rate,market
right time for rice khad,advice
should i give seeds to rise 2day?,advice
white powder on rise,disease
is paise up for makka 2day?,market
is there any schem for tamatar farmers,subsidy
pest kanak help,disease
kisan credit card schem,subsidy
how is the mosam today?,weather
what is the market of sarso today?,market
whatis the rate of tomato aaj?,market
need help with kanak fertilizer,advice
tell me kanak pryce,market
bugsin tamatar,disease
any chance of dhoop tomorrow?,weather
tomato is dying what to do,disease
intercropping with gehun,advice
whento plant potato?,advice
kya tomorrow weather hogi?,weather
is pryce up for gehu 2day,market
market market for sarso??,market
is rate up for soybean aaj?,market
is barish coming?,weather
is mosam coming?,weather
baarish alert needed,weather
tomato ka baav kya hai today?,market
howis the mosam aaj?,weather
kya tomorow wedder hogi,weather
need pm kisan for farming,subsidy
best plant for cotton,advice
how is the baarish today?,weather
TELL ME RICE MANDI,market
WILL IT RAIN KAL?,weather
white powder on potato,disease
where to sell wheat for good mkt,market
right time for soyabean ugana,advice
my onion leaves are turning yellow,disease
TEMP ALERT NEEDED,weather
will it baarish tomorrow?,weather
is there any pm kisan for tomato farmers,subsidy
bugsin gehu,disease
how much boi for pyaz?,advice
kisan credit card sarkar,subsidy
ganna ke liye kaun sa seeds acha hai?,advice
should i give grow to ganna now?,advice
sabsidistatus,subsidy
dhoop forecast for punjab,weather
how much water for wheet,advice
where to sell ganna for good ret,market
sarkar status,subsidy
shouldi give ugana to mustard aaj?,advice
medicinefor chawal disease,disease
when to urea soyabean?,advice
too much heat for tamatar,weather
PMsarkar details,subsidy
rain kal,weather
temp forecast for punjab,weather
wheet me bugs lag gaya,disease
PMsabsidi details,subsidy
spots on wheet fasal,disease
pm kisan status,subsidy
gehun is dying what to do,disease
karz form kaha milega,subsidy
MY SOYABEAN STEM ARE TURNING YELLOW,disease
spots on kapas tana,disease
too much barish for gehu,weather
intercropping with tamatar,advice
right time for kapas water,advice
tamatar ka ret kya hai 2day?,market
PM karz details,subsidy
right time for gehun dap,advice
schem for tractor,subsidy
tell me dhan ret,market
best pani for aloo,advice
bank form kaha milega,subsidy
intercropping with kapas,advice
current aloo pryce pryce,market
how much urea for soybean?,advice
temp next day,weather
dying attack on ganna,disease
should i give beej to sugarcane td?,advice
medicine for kanak sukha,disease
pyaz market,market
when to grow tomato?,advice
schemeform kaha milega,subsidy
how much pani for sugarcane,advice
any chance of wether 2moro?,weather
tomato ke liye kaun sa khad acha hai?,advice
ismosam coming?,weather
too much barish for ganna,weather
should i give grow to chawal todday?,advice
IS MAUSAM COMING,weather
current kapas paise paise,market
subsidy for tractor,subsidy
bugs in rice,disease
kapas is dying what to do,disease
kisan credit card yojana,subsidy
PMpm kisan details,subsidy
howis the mausam aaj,weather
barish forecast for punjab,weather
PEST KAPAS HELP,disease
govt sabsidi for pyaz,subsidy
WHERETO SELL WHEAT FOR GOOD MKT,market
is pryce up for potato aaj,market
intercropping with soyabean,advice
sick attack on kanak,disease
gehun me dry lag gaya,disease
yellowing ganna help,disease
isthere any pm kisan for wheet farmers?,subsidy
whitepowder on soyabean,disease
PM sarkar details,subsidy
wheetprise,market
keeda attack on kapas,disease
spots on chawal tana,disease
is there any yojana for rise farmers,subsidy
SELL PYAZ 2DAY MARKET,market
soybeanka markit kya hai aaj?,market
bugs in cotton,disease
intercropping with sugarcane,advice
KISAN CREDIT CARD YOJANA,subsidy
how to apply for scheme,subsidy
howis the temp now?,weather
spots on sarso stem,disease
PM sabsidi details,subsidy
medicine for wheat bugs,disease
loan status,subsidy
intercropping with wheet,advice
kya tmrw dhoop hogi?,weather
IS MOSAM COMING,weather
how is the heat now?,weather
will it mausam tomorrow?,weather
when to beej sugarcane?,advice
my onion root are turning yellow,disease
where to sell sarso for good market,market
any chance of heat tmrw,weather
mkt mkt for tamatar??,market
should i give water to chawal td?,advice
spotson gehun fasal,disease
pyaz me dry lag gaya,disease
TELL ME SUGARCANE BAAV,market
what khad for ganna?,advice
SPOTS ON COTTON STEM,disease
SELL RICE 2DAY PRYCE,market
WHAT IS THE MARKIT OF RICE TODDAY,market
best khad for sugarcane,advice
tell me rise pryce,market
BANK STATUS,subsidy
my cotton root are turning yellow,disease
MAUSAM FORECAST FOR PUNJAB,weather
how is the wedder now?,weather
kya next day temp hogi?,weather
yellowing wheat help,disease
govt bank for dhan,subsidy
sell corn 2day prise,market
barish alert needed,weather
where to sell kanak for good baav,market
right time for gehun ugana,advice
whereto sell tomato for good ret,market
is mausam coming?,weather
MY KAPAS TANA ARE TURNING YELLOW,disease
when to khad rise,advice
need scheme for farming,subsidy
rain forecast for punjab,weather
IS THERE ANY SCHEM FOR MUSTARD FARMERS?,subsidy
any chance of baarish 2moro,weather
kapas ka mkt kya hai aaj,market
how to save pyaz from disease,disease
heat next day,weather
kya tmrw mosam hogi?,weather
current rice market market,market
bugs in sugarcane,disease
NEED BANK FOR FARMING,subsidy
whereto sell makka for good ret,market
loan for tractor,subsidy
intercropping with wheet,advice
bugs in sugarcane,disease
HOW MUCH WATER FOR ALOO?,advice
my tomato crop are turning yellow,disease
white powder on kapas,disease
white powder on pyaz,disease
intercropping with soybean,advice
potato me yellowing lag gaya,disease
PM sarkar details,subsidy
my gehun stem are turning yellow,disease
sell dhan now price,market
kapas ke liye kaun sa dap acha hai?,advice
current aloo markit markit,market
where to sell wheat for good market,market
SHOULD I GIVE KHAD TO SOYABEAN 2DAY?,advice
whereto sell potato for good market,market
current rise ret ret,market
how to save soyabean from sukha,disease
anychance of mausam 2moro,weather
right time for sugarcane plant,advice
kya next day baarish hogi?,weather
kisan credit card sarkar,subsidy
best ugana for rice,advice
will it rain tmrw?,weather
dying attack on soyabean,disease
right time for wheet pani,advice
mosam alert needed,weather
ret ret for corn,market
SPOTS ON POTATO ROOT,disease
barishtomorow,weather
spots on chawal stem,disease
gehu is dying what to do,disease
spots on cotton jad,disease
white powder on rice,disease
where to sell makka for good price,market
corn is dying what to do,disease
bugsin rice,disease
bank for tractor,subsidy
heat forecast for punjab,weather
current ganna mkt mkt,market
mausamalert needed,weather
how to save tamatar from dry,disease
need help with soybean water,advice
where to sell makka for good bhav,market
sell wheet now ret,market
best plant for soybean,advice
is rate up for kanak aaj?,market
wedder alert needed,weather
kisan credit card loan,subsidy
selldhan now mkt,market
PM sabsidi details,subsidy
govt scheme for wheat,subsidy
PMgovt details,subsidy
corn me disease lag gaya,disease
any chance of barish tmrw?,weather
spots on rise pattiyan,disease
current cotton mkt mkt,market
bugs in onion,disease
PM karz details,subsidy
IS WETHER COMING?,weather
is dhoop coming?,weather
tamatarme bugs lag gaya,disease
is mosam coming?,weather
howto apply for sarkar,subsidy
is there any sarkar for makka farmers,subsidy
shouldi give grow to mustard todday?,advice
toomuch temp for chawal,weather
wheat pryce,market
needhelp with soybean beej,advice
is there any sabsidi for kapas farmers?,subsidy
bank form kaha milega,subsidy
how to apply for scheme,subsidy
PM pm kisan details,subsidy
rate rate for wheat,market
sell sugarcane now bhav,market
pryce pryce for onion,market
white powder on mustard,disease
how much ugana for cotton?,advice
how to save soyabean from pest,disease
how is the wedder today,weather
kya next day temp hogi,weather
current dhan bhav bhav,market
how to apply for sarkar,subsidy
medicine for sugarcane spots,disease
bugs in wheat,disease
what khad for onion?,advice
will it wedder tmrw?,weather
sick rise help,disease
sarso is dying what to do,disease
is barish coming,weather
cottonke liye kaun sa beej acha hai?,advice
PM schem details,subsidy
is weather coming?,weather
white powder on dhan,disease
MY SARSO PATTIYAN ARE TURNING YELLOW,disease
spots on kapas tana,disease
is pryce up for gehun aaj?,market
medicine for sarso bimari,disease
current tamatar paise paise,market
need help with tomato seeds,advice
pm kisan status,subsidy
scheme status,subsidy
how to save wheet from spots,disease
how to save makka from yellowing,disease
pestsugarcane help,disease
is mandi up for kapas todday,market
sarso ka markit kya hai aaj?,market
how is the baarish td?,weather
when to grow gehu?,advice
HOW MUCH BEEJ FOR GEHUN?,advice
bugsin ganna,disease
will it barish tomorrow?,weather
how to save pyaz from keeda,disease
yojana for tractor,subsidy
white powder on soyabean,disease
bestboi for makka,advice
how to apply for yojana,subsidy
what is the prise of sugarcane td,market
will it weather tomorow,weather
should i give water to aloo 2day,advice
paisepaise for ganna??,market
how to apply for schem,subsidy
gehuke liye kaun sa grow acha hai?,advice
spots on soybean tana,disease
howto apply for schem,subsidy
best grow for tomato,advice
WHERE TO SELL COTTON FOR GOOD PAISE,market
how is the temp now?,weather
scheme form kaha milega,subsidy
howto save wheat from dry,disease
best beej for chawal,advice
pm kisan form kaha milega,subsidy
best plant for pyaz,advice
when to water chawal?,advice
right time for pyaz beej,advice
schem form kaha milega,subsidy
WHAT WATER FOR MUSTARD,advice
mausam forecast for punjab,weather
how to save soybean from yellowing,disease
how is the baarish today,weather
kanak is dying what to do,disease
is wether coming?,weather
how is the wedder today?,weather
current makka prise prise,market
whatis the prise of wheet now?,market
any chance of weather next day?,weather
WILLIT DHOOP KAL?,weather
dhoopforecast for punjab,weather
white powder on kanak,disease
MAUSAM FORECAST FOR PUNJAB,weather
howto save gehu from dry,disease
what beej for wheat,advice
need help with kanak plant,advice
yojanaform kaha milega,subsidy
disease tomato help,disease
barish forecast for punjab,weather
govt for tractor,subsidy
how is the wedder 2day,weather
need help with dhan grow,advice
bank form kaha milega,subsidy
PM scheme details,subsidy
baav baav for aloo??,market
what is the rate of wheet 2day?,market
is temp coming,weather
any chance of mosam tmrw?,weather
intercroppingwith pyaz,advice
PM karz details,subsidy
dhoop tomorow,weather
will it baarish tomorrow?,weather
markit markit for onion??,market
need help with soyabean pani,advice
is there any bank for corn farmers?,subsidy
dry attack on corn,disease
how much grow for rice?,advice
what is the mandi of chawal aaj?,market
pestganna help,disease
PM scheme details,subsidy
dhan ka prise kya hai now,market
need help with soyabean pani,advice
tell me tamatar price,market
PM karz details,subsidy
how to apply for sabsidi,subsidy
sarkar status,subsidy
gehun rate,market
too much baarish for sugarcane,weather
dhoop tomorow,weather
willit wedder tmrw?,weather
what is the mkt of dhan aaj,market
RAIN FORECAST FOR PUNJAB,weather
what beej for pyaz?,advice
govt bank for makka,subsidy
should i give plant to dhan td,advice
sabsidi status,subsidy
bugs in cotton,disease
keeda attack on ganna,disease
is price up for wheet 2day?,market
will it heat tomorrow?,weather
right time for rise plant,advice
wheetke liye kaun sa fertilizer acha hai?,advice
chawal prise,market
needhelp with dhan dap,advice
kya kal mosam hogi?,weather
dhan market,market
how to apply for scheme,subsidy
PM sabsidi details,subsidy
my pyaz root are turning yellow,disease
howmuch grow for potato?,advice
is there any karz for soybean farmers?,subsidy
soybean me sukha lag gaya,disease
too much wedder for sugarcane,weather
disease makka help,disease
rain forecast for punjab,weather
SHOULD I GIVE UREA TO SOYABEAN NOW,advice
SPOTS ON SUGARCANE CROP,disease
what dap for cotton?,advice
baarish kal,weather
what is the bhav of makka now,market
tomato ke liye kaun sa beej acha hai?,advice
righttime for rice khad,advice
will it mausam next day?,weather
need help with wheet urea,advice
mustard is dying what to do,disease
SHOULD I GIVE KHAD TO RISE AAJ?,advice
is there any subsidy for wheat farmers?,subsidy
sukhadhan help,disease
heat tomorrow,weather
schemstatus,subsidy
kya tomorrow rain hogi?,weather
pyaz ka pryce kya hai now?,market
best dap for sugarcane,advice
howto save pyaz from spots,disease
need help with rice water,advice
white powder on chawal,disease
mausamalert needed,weather
yojana status,subsidy
wheet me disease lag gaya,disease
white powder on corn,disease
WHAT IS THE RATE OF PYAZ NOW,market
sarkar for tractor,subsidy
schemfor tractor,subsidy
how to save kapas from bugs,disease
willit heat next day?,weather
sugarcane me keeda lag gaya,disease
ganna price,market
kya kal rain hogi?,weather
what water for cotton?,advice
sarso ka market kya hai 2day?,market
PM pm kisan details,subsidy
where to sell soybean for good mkt,market
should i give pani to kapas 2day,advice
need karz for farming,subsidy
bugs in dhan,disease
how is the wedder now?,weather
white powder on soyabean,disease
intercropping with dhan,advice
need help with makka beej,advice
govt bank for sarso,subsidy
how to save rice from spots,disease
medicinefor potato bimari,disease
what fertilizer for mustard?,advice
where to sell gehun for good price,market
how to save kanak from keeda,disease
barish kal,weather
current cotton price price,market
howis the mausam today?,weather
SHOULD I GIVE BEEJ TO RISE AAJ?,advice
how is the temp td?,weather
PM bank details,subsidy
is wether coming?,weather
bugs in corn,disease
wheat paise,market
too much dhoop for kapas,weather
right time for pyaz beej,advice
YOJANA FORM KAHA MILEGA,subsidy
is heat coming?,weather
spots on cotton jad,disease
bugsin rice,disease
toomuch wether for onion,weather
will it mosam tomorrow,weather
mandi mandi for cotton,market
white powder on rise,disease
best plant for pyaz,advice
current soyabean paise paise,market
makka ke liye kaun sa ugana acha hai?,advice
where to sell tomato for good pryce,market
spots on kanak jad,disease
tell me sugarcane ret,market
WILLIT MOSAM TMRW,weather
white powder on aloo,disease
wheet ka market kya hai aaj?,market
how to apply for sarkar,subsidy
weather forecast for punjab,weather
should i give ugana to soyabean aaj?,advice
PM pm kisan details,subsidy
govtfor tractor,subsidy
cottonme yellowing lag gaya,disease
POTATO PRICE,market
sugarcaneka market kya hai aaj?,market
schem status,subsidy
sarsoke liye kaun sa khad acha hai?,advice
will it heat tmrw?,weather
kya tomorow weather hogi,weather
mykapas fasal are turning yellow,disease
schemstatus,subsidy
govt schem for soyabean,subsidy
DHAN KE LIYE KAUN SA BEEJ ACHA HAI?,advice
how is the rain now?,weather
when to boi soybean?,advice
is paise up for rise now?,market
righttime for soyabean beej,advice
right time for soybean dap,advice
howis the temp 2day?,weather
mymustard stem are turning yellow,disease
how is the temp aaj?,weather
how much pani for soybean,advice
current gehun price price,market
weathernext day,weather
how much pani for sarso,advice
rise ke liye kaun sa grow acha hai?,advice
kya kal mausam hogi,weather
kanakme pest lag gaya,disease
will it heat tomorow?,weather
best seeds for rice,advice
where to sell cotton for good price,market
is dhoop coming,weather
white powder on kanak,disease
any chance of mosam 2moro?,weather
when to pani soyabean?,advice
medicine for rice spots,disease
SOYABEAN ME KEEDA LAG GAYA,disease
MAKKA IS DYING WHAT TO DO,disease
INTERCROPPING WITH MAKKA,advice
too much wether for rise,weather
howto apply for subsidy,subsidy
is rain coming?,weather
tell me dhan market,market
dhoop forecast for punjab,weather
whatis the pryce of tamatar todday?,market
cotton ke liye kaun sa urea acha hai?,advice
how to apply for loan,subsidy
rice me keeda lag gaya,disease
how much plant for soyabean,advice
WHEN TO UGANA KANAK?,advice
spotsattack on cotton,disease
govt bank for mustard,subsidy
righttime for ganna khad,advice
dying corn help,disease
tomato ke liye kaun sa beej acha hai,advice
need help with gehun boi,advice
kisan credit card loan,subsidy
what is the baav of potato todday?,market
yojana status,subsidy
KARZ FORM KAHA MILEGA,subsidy
spots on rise leaves,disease
wedderalert needed,weather
rice ka paise kya hai now?,market
yellowing soyabean help,disease
is wether coming?,weather
how to apply for sarkar,subsidy
best seeds for sarso,advice
bugs in sarso,disease
temp tmrw,weather
bank form kaha milega,subsidy
sell aloo now bhav,market
tell me rice prise,market
sabsidi form kaha milega,subsidy
KISAN CREDIT CARD YOJANA,subsidy
best plant for soybean,advice
bank status,subsidy
BANKFORM KAHA MILEGA,subsidy
pmkisan form kaha milega,subsidy
any chance of barish 2moro?,weather
govt govt for corn,subsidy
dryattack on makka,disease
makka ka baav kya hai td?,market
govt status,subsidy
intercroppingwith wheet,advice
tellme aloo markit,market
scheme for tractor,subsidy
when to beej pyaz?,advice
WHERE TO SELL RICE FOR GOOD MKT,market
bank for tractor,subsidy
how to apply for subsidy,subsidy
mustard ka mkt kya hai today,market
isthere any karz for wheat farmers?,subsidy
kanakret,market
current wheet paise paise,market
subsidy for tractor,subsidy
any chance of barish tmrw?,weather
is weather coming,weather
how is the mausam aaj?,weather
need bank for farming,subsidy
shouldi give seeds to gehun todday?,advice
how much beej for onion?,advice
govt bank for gehu,subsidy
PM karz details,subsidy
whereto sell sarso for good mandi,market
is mkt up for aloo now?,market
how is the mausam today,weather
kisan credit card govt,subsidy
need help with gehun plant,advice
bugsin aloo,disease
any chance of wedder tomorrow,weather
should i give fertilizer to rice aaj?,advice
how is the wedder todday,weather
mausam kal,weather
current sugarcane prise prise,market
kya tomorrow wether hogi?,weather
intercroppingwith tomato,advice
sell wheet today mkt,market
tell me tamatar pryce,market
MEDICINE FOR CORN DISEASE,disease
WHAT GROW FOR SARSO?,advice
CURRENT MAKKA RET RET,market
white powder on sugarcane,disease
whitepowder on soybean,disease
need pm kisan for farming,subsidy
CURRENTCOTTON RATE RATE,market
loan for tractor,subsidy
best urea for corn,advice
spots on tamatar fasal,disease
pm kisan for tractor,subsidy
DRY ATTACK ON PYAZ,disease
scheme for tractor,subsidy
is mandi up for dhan 2day?,market
sarkarfor tractor,subsidy
tomatois dying what to do,disease
needscheme for farming,subsidy
will it mosam next day?,weather
should i give khad to corn 2day?,advice
sell kapas todday markit,market
how to save aloo from dying,disease
bimari attack on potato,disease
potato ka prise kya hai now?,market
right time for soybean grow,advice
bank form kaha milega,subsidy
intercropping with kanak,advice
is dhoop coming,weather
need bank for farming,subsidy
soyabean ka markit kya hai td?,market
dying attack on mustard,disease
is weather coming?,weather
my ganna leaves are turning yellow,disease
gehu ke liye kaun sa seeds acha hai,advice
should i give dap to mustard aaj,advice
govt status,subsidy
mausamforecast for punjab,weather
tell me kanak bhav,market
GOVT SUBSIDY FOR CHAWAL,subsidy
medicinefor wheat sick,disease
right time for tomato pani,advice
is wether coming?,weather
how much dap for aloo,advice
is there any sabsidi for mustard farmers?,subsidy
best grow for rise,advice
what beej for aloo?,advice
need pm kisan for farming,subsidy
is markit up for chawal td?,market
ganname sukha lag gaya,disease
how to save soybean from keeda,disease
pest attack on gehu,disease
gehu ke liye kaun sa beej acha hai?,advice
is bhav up for tomato now?,market
what ugana for corn?,advice
mustard mkt,market
subsidyfor tractor,subsidy
disease makka help,disease
kanak ka pryce kya hai td,market
soyabean price,market
sell onion today price,market
sarkar form kaha milega,subsidy
bimari wheet help,disease
sukha rice help,disease
baav baav for kapas,market
govt form kaha milega,subsidy
potato ka bhav kya hai aaj?,market
sell tomato 2day prise,market
white powder on wheet,disease
medicinefor dhan dry,disease
NEED GOVT FOR FARMING,subsidy
where to sell soybean for good price,market
medicine for pyaz disease,disease
is there any schem for cotton farmers?,subsidy
cotton me sukha lag gaya,disease
rise me disease lag gaya,disease
soybean ka rate kya hai todday?,market
need schem for farming,subsidy
diseasewheat help,disease
bugsin soybean,disease
tell me potato ret,market
subsidy for tractor,subsidy
iswether coming?,weather
spots on tomato pattiyan,disease
when to water cotton?,advice
is there any loan for makka farmers,subsidy
bugs in tomato,disease
is price up for ganna td?,market
sellpotato now market,market
how is the mausam now?,weather
mausamforecast for punjab,weather
howto apply for scheme,subsidy
how to save chawal from pest,disease
scheme for tractor,subsidy
whento water rice,advice
govtpm kisan for rice,subsidy
mkt mkt for mustard??,market
need help with cotton ugana,advice
too much barish for potato,weather
whatfertilizer for aloo,advice
need schem for farming,subsidy
wedder alert needed,weather
how to apply for pm kisan,subsidy
tell me gehun rate,market
any chance of wedder next day?,weather
current cotton pryce pryce,market
mosam forecast for punjab,weather
is dhoop coming?,weather
PM scheme details,subsidy
need help with makka fertilizer,advice
tomato markit,market
my soybean crop are turning yellow,disease
is weather coming,weather
sarkar form kaha milega,subsidy
isweather coming,weather
sell gehun now market,market
rice is dying what to do,disease
bank form kaha milega,subsidy
shouldi give beej to gehun td?,advice
RIGHT TIME FOR WHEAT PLANT,advice
kya tmrw baarish hogi,weather
kapas is dying what to do,disease
is baarish coming?,weather
SELL DHAN NOW PRISE,market
too much wether for kanak,weather
when to plant tomato?,advice
need help with corn fertilizer,advice
white powder on ganna,disease
baarish forecast for punjab,weather
best seeds for sarso,advice
barish tmrw,weather
right time for tamatar dap,advice
